Pais	Provincia	Partido	Localidad	ADSL	Cablemódem	Dial Up	Fibra óptica	4G	3G	Telefonía Fija	Wireless	Satelital	Total	Latitude	Longitude	location
ARGENTINA	RIO NEGRO	General Roca	Barrio Santa Rita	0	0	0	0	0	0	0	0	0	0	-39.1263897	-67.1026593	Santa Rita, Municipio de Villa Regina, Departamento General Roca, Río Negro, Argentina
ARGENTINA	RIO NEGRO	General Roca	Barrio Tres Luces	0	0	0	0	1	1	0	0	0	2	-38.973631	-67.9532742	Tres Luces, María Elvira, Municipio de Cipolletti, Departamento General Roca, Río Negro, Argentina
ARGENTINA	RIO NEGRO	General Roca	Barrio Unión	0	0	0	0	0	0	0	0	0	0	-39.0562084	-67.5363285	La Unión, Padre Stefenelli, Municipio de General Roca, Departamento General Roca, Río Negro, 8232, Argentina
ARGENTINA	RIO NEGRO	General Roca	Catriel	0	0	0	1	1	1	0	1	1	5	-39.0452745	-67.5051109	Cacique Catriel, Municipio de General Roca, Departamento General Roca, Río Negro, 8232, Argentina
ARGENTINA	RIO NEGRO	General Roca	Cervantes	0	1	0	0	1	0	1	1	1	5	-39.0549971	-67.5631874	Cervantes, Victoriano, Municipio de General Roca, Departamento General Roca, Río Negro, 8232, Argentina
ARGENTINA	RIO NEGRO	General Roca	Chichinales	0	0	0	1	1	1	1	1	1	6	-39.1147944	-66.942429	Chichinales, Municipio de Chichinales, Departamento General Roca, Río Negro, Argentina
ARGENTINA	RIO NEGRO	General Roca	Cinco Saltos	1	0	1	1	1	1	1	1	1	8	-38.8275693	-68.0661786	Cinco Saltos, Municipio de Cinco Saltos, Departamento General Roca, Río Negro, Argentina
ARGENTINA	RIO NEGRO	General Roca	Cipolletti	1	1	1	1	1	1	1	1	1	9	-39.0297221	-67.5920487	Cipolletti, Parque San Juan, General Roca, Municipio de General Roca, Departamento General Roca, Río Negro, R8332, Argentina
ARGENTINA	RIO NEGRO	General Roca	Contralmirante Cordero	0	0	0	0	1	0	1	1	1	4	-38.7578252	-68.0997165	Contralmirante Cordero, Municipio de Contralmirante Cordero - Barda del Medio, Departamento General Roca, Río Negro, R8301, Argentina
ARGENTINA	RIO NEGRO	General Roca	Ferri	0	0	0	0	1	1	0	1	0	3	-38.8878798	-68.0065668	Ferri, Municipio de Cipolletti, Departamento General Roca, Río Negro, Argentina
ARGENTINA	RIO NEGRO	General Roca	General Enrique Godoy	0	0	0	1	1	1	0	1	1	5	-39.078126499999996	-67.15931995535784	General Enrique Godoy, Municipio de General Enrique Godoy, Departamento General Roca, Río Negro, Argentina
ARGENTINA	RIO NEGRO	General Roca	General Fernández Oro	1	0	1	1	1	1	1	1	1	8	-38.9563161	-67.9212057	General Fernández Oro, Municipio de General Fernández Oro, Departamento General Roca, Río Negro, 8325, Argentina
ARGENTINA	RIO NEGRO	General Roca	General Roca	1	1	1	1	1	1	1	1	1	9	-39.0266276	-67.5754863	General Roca, Municipio de General Roca, Departamento General Roca, Río Negro, Argentina
ARGENTINA	RIO NEGRO	General Roca	Ingeniero Luis A. Huergo	1	0	1	1	1	1	1	1	1	8	-39.0707896	-67.2368414	Municipio de Ingeniero Huergo, Departamento General Roca, Río Negro, Argentina
ARGENTINA	RIO NEGRO	General Roca	Ingeniero Otto Krause	0	0	0	0	0	0	0	0	0	0	-39.1070598	-66.9980861	Ingeniero Otto Krause, Municipio de Chichinales, Departamento General Roca, Río Negro, Argentina
ARGENTINA	RIO NEGRO	General Roca	Mainqué	0	0	0	0	1	0	0	1	1	3	-39.06560935	-67.30423784814352	Mainqué, Municipio de Mainqué, Departamento General Roca, Río Negro, Argentina
ARGENTINA	RIO NEGRO	General Roca	Paso Córdova	0	0	0	0	0	0	0	0	0	0	-39.1427665	-67.67100616871377	Área Natural Protegida Municipal Paso Cordova, Municipio de General Roca, Departamento El Cuy, Río Negro, Argentina
ARGENTINA	RIO NEGRO	General Roca	Peñas Blancas	0	0	0	0	0	0	0	0	1	1	-37.6929439	-67.8684506	Peñas Blancas, Departamento General Roca, Río Negro, Argentina
ARGENTINA	RIO NEGRO	General Roca	Península Ruca Co	0	0	0	0	0	0	0	0	0	0	-38.7013827	-68.0286467	Península Ruca Co, Municipio de Cinco Saltos, Departamento General Roca, Río Negro, Argentina
ARGENTINA	RIO NEGRO	General Roca	Puente Cero	0	0	0	0	1	1	0	0	0	2	-39.0314247	-67.5021632	Avenida Puente Cero, Municipio de General Roca, Departamento General Roca, Río Negro, 8232, Argentina
ARGENTINA	RIO NEGRO	General Roca	Sargento Vidal	0	0	0	0	1	0	0	1	0	2	-38.68638	-68.1585703	Sargento Vidal, Municipio de Campo Grande, Departamento General Roca, Río Negro, Argentina
ARGENTINA	RIO NEGRO	General Roca	Tres Luces	0	0	0	0	0	0	0	0	0	0	-38.973631	-67.9532742	Tres Luces, María Elvira, Municipio de Cipolletti, Departamento General Roca, Río Negro, Argentina
ARGENTINA	RIO NEGRO	General Roca	Villa Alberdi	0	0	0	0	0	0	0	0	1	1	-39.1281222	-67.0505507	Villa Alberdi, Municipio de Villa Regina, Departamento General Roca, Río Negro, Argentina
ARGENTINA	RIO NEGRO	General Roca	Villa del Parque	0	0	0	0	0	0	0	0	0	0	-39.1261443	-66.9974613	Villa del Parque, Municipio de Chichinales, Departamento General Roca, Río Negro, Argentina
ARGENTINA	RIO NEGRO	General Roca	Villa Manzano	0	0	0	0	1	1	1	1	1	5	-38.6806241	-68.2159844	Villa Manzano, Municipio de Campo Grande, Departamento General Roca, Río Negro, Argentina
ARGENTINA	RIO NEGRO	General Roca	Villa Regina	1	0	1	1	1	1	1	1	1	8	-39.0987435	-67.0852996	Villa Regina, Municipio de Villa Regina, Departamento General Roca, Río Negro, Argentina
ARGENTINA	RIO NEGRO	General Roca	Villa San Isidro	0	0	0	1	0	1	0	1	0	3			
ARGENTINA	RIO NEGRO	Ñorquincó	Las Bayas	0	0	0	0	0	0	0	0	0	0	-41.4560195	-70.6685373	Las Bayas, Municipio de Pilcaniyeu, Departamento Ñorquincó, Río Negro, Argentina
ARGENTINA	RIO NEGRO	Ñorquincó	Mamuel Choique	0	0	0	1	0	0	1	0	0	2	-41.7713937	-70.1377809	Mamuel Choique, Departamento Ñorquincó, Río Negro, Argentina
ARGENTINA	RIO NEGRO	Ñorquincó	Ñorquincó	0	0	0	0	0	0	1	0	1	2	-41.8505847	-70.9026924	Ñorquincó, Municipio de Ñorquincó, Departamento Ñorquincó, Río Negro, Argentina
ARGENTINA	RIO NEGRO	Ñorquincó	Ojos de Agua	0	0	0	0	0	0	1	0	0	1	-41.5563404	-69.8692134	Ojos de Agua, Departamento Ñorquincó, Río Negro, Argentina
ARGENTINA	RIO NEGRO	Ñorquincó	Río Chico (Est. Cerro Mesa)	0	0	0	0	0	0	1	0	1	2			
ARGENTINA	RIO NEGRO	Pichi Mahuida	Barrio Esperanza	0	0	0	1	0	0	0	0	0	1	-39.04518905	-63.99854244609813	Barrio Esperanza, Municipio de Río Colorado, Departamento Pichi Mahuida, Río Negro, Argentina
ARGENTINA	RIO NEGRO	Pichi Mahuida	Colonia Juliá y Echarren	0	1	0	1	1	0	0	1	1	5	-39.0352331	-64.02733	Colonia Juliá y Echarren, Municipio de Río Colorado, Departamento Pichi Mahuida, Río Negro, Argentina
ARGENTINA	RIO NEGRO	Pichi Mahuida	Juventud Unida	0	0	0	1	0	0	0	0	0	1			
ARGENTINA	RIO NEGRO	Pichi Mahuida	Pichi Mahuida	0	0	0	0	0	0	0	0	0	0	-38.8312804	-64.9351268	Pichi Mahuida, Departamento Pichi Mahuida, Río Negro, Argentina
ARGENTINA	RIO NEGRO	Pichi Mahuida	Río Colorado	1	1	1	1	1	1	1	1	1	9	-38.9908428	-64.0957548	Río Colorado, Municipio de Río Colorado, Departamento Pichi Mahuida, Río Negro, 8138, Argentina
ARGENTINA	RIO NEGRO	Pichi Mahuida	Salto Andersen	0	0	0	0	0	0	0	0	1	1	-38.8250028	-64.8193321	Salto Andersen, Municipio de Río Colorado, Departamento Pichi Mahuida, Río Negro, Argentina
ARGENTINA	RIO NEGRO	Pilcaniyeu	Cañadón Chileno	0	0	0	0	0	0	0	0	0	0	-40.9107673	-70.2116018	Cañadón Chileno, Departamento Pilcaniyeu, Río Negro, Argentina
ARGENTINA	RIO NEGRO	Pilcaniyeu	Comallo	0	0	0	1	1	0	0	1	1	4	-41.0318348	-70.2637661	Comallo, Municipio de Comallo, Departamento Pilcaniyeu, Río Negro, R8416, Argentina
ARGENTINA	RIO NEGRO	Pilcaniyeu	Dina Huapi	1	0	1	1	1	1	1	1	1	8	-41.0761031	-71.1720318	Dina Huapi, Municipio de Dina Huapi, Departamento Pilcaniyeu, Río Negro, Argentina
ARGENTINA	RIO NEGRO	Pilcaniyeu	Laguna Blanca	0	0	0	0	0	0	0	0	1	1	-40.7219381	-69.841449	Laguna Blanca, Departamento Pilcaniyeu, Río Negro, Argentina
ARGENTINA	RIO NEGRO	Pilcaniyeu	Ñirihuau	0	0	0	0	0	0	0	0	0	0	-41.2522006	-71.1822521	Ñirihuau Arriba, Municipio de Pilcaniyeu, Departamento Bariloche, Río Negro, Argentina
ARGENTINA	RIO NEGRO	Pilcaniyeu	Paso Flores	0	0	0	0	0	0	0	0	1	1	-40.6045328	-70.7157996	Paso Flores, Municipio de Pilcaniyeu, Departamento Pilcaniyeu, Río Negro, Argentina
ARGENTINA	RIO NEGRO	Pilcaniyeu	Pilcaniyeu	0	0	0	0	0	0	0	0	1	1	-41.1223885	-70.722091	Pilcaniyeu, Municipio de Pilcaniyeu, Departamento Pilcaniyeu, Río Negro, Argentina
ARGENTINA	RIO NEGRO	Pilcaniyeu	Pilquiniyeu del Limay	0	0	0	1	0	0	0	0	0	1	-40.5175043	-70.0278573	Pilquiniyeu del Limay, Departamento Pilcaniyeu, Río Negro, Argentina
ARGENTINA	RIO NEGRO	Pilcaniyeu	Villa Llanquín	0	0	0	0	0	0	0	0	1	1	-40.8947405	-71.0367545	Villa Llanquín, Departamento Pilcaniyeu, Río Negro, R8401, Argentina
ARGENTINA	RIO NEGRO	San Antonio	El Empalme	0	0	0	0	0	0	0	0	0	0			
ARGENTINA	RIO NEGRO	San Antonio	Las Grutas	1	0	1	1	1	1	1	0	1	7	-40.99382145	-65.47633599512861	Las Grutas, Departamento San Antonio, Río Negro, Argentina
ARGENTINA	RIO NEGRO	San Antonio	Playas Doradas	0	0	0	0	0	0	0	1	0	1	-41.6308288	-65.0297822	Playas Doradas, Sierra Grande, Departamento San Antonio, Río Negro, Argentina
ARGENTINA	RIO NEGRO	San Antonio	Puerto San Antonio Este	1	0	0	1	0	0	1	1	1	5	-40.8032688	-64.8826723	Prefectura Naval Argentina, San Antonio Este, San Antonio Oeste, Departamento San Antonio, Río Negro, Argentina
ARGENTINA	RIO NEGRO	San Antonio	Punta Colorada	0	0	0	0	0	0	0	1	0	1	-41.6942467	-65.029141	Punta Colorada, Sierra Grande, Departamento San Antonio, Río Negro, Argentina
ARGENTINA	RIO NEGRO	San Antonio	Saco Viejo	0	0	0	0	0	0	0	1	0	1	-40.815791	-64.7567852	Saco Viejo, San Antonio Oeste, Departamento San Antonio, Río Negro, Argentina
ARGENTINA	RIO NEGRO	San Antonio	San Antonio Oeste	1	0	1	1	1	1	1	1	1	8	-40.7302125	-64.9389955	San Antonio Oeste, Departamento San Antonio, Río Negro, Argentina
ARGENTINA	RIO NEGRO	San Antonio	Sierra Grande	1	0	1	1	1	1	1	1	1	8	-41.605351	-65.3568775	Sierra Grande, Departamento San Antonio, Río Negro, Argentina
ARGENTINA	RIO NEGRO	Valcheta	Aguada Cecilio	0	0	0	1	0	0	0	0	0	1	-40.8487516	-65.8420988	Aguada Cecilio, Departamento Valcheta, Río Negro, Argentina
ARGENTINA	RIO NEGRO	Valcheta	Arroyo Los Berros	0	0	0	0	0	0	0	0	1	1	-41.4723483	-66.3146997	Arroyo Los Berros, Departamento Valcheta, Río Negro, Argentina
ARGENTINA	RIO NEGRO	Valcheta	Arroyo Ventana	0	0	0	0	0	0	1	0	1	2	-41.6688436	-66.096306	Arroyo de la Ventana, Departamento Valcheta, Río Negro, R8352, Argentina
ARGENTINA	RIO NEGRO	Valcheta	Nahuel Niyeu	0	0	0	1	0	0	0	0	0	1	-40.5045031	-66.5644137	Nahuel Niyeu, Departamento Valcheta, Río Negro, Argentina
ARGENTINA	RIO NEGRO	Valcheta	Sierra Pailemán	0	0	0	0	0	0	1	0	1	2	-41.1904124	-65.9776742	Sierra Pailemán, Departamento Valcheta, Río Negro, Argentina
ARGENTINA	RIO NEGRO	Valcheta	Valcheta	0	0	0	1	1	0	1	1	1	5	-40.6748102	-66.1671314	Valcheta, Municipio de Valcheta, Departamento Valcheta, Río Negro, 8536, Argentina
ARGENTINA	SALTA	Anta	Apolinario Saravia	0	1	0	1	1	1	1	1	1	7	-24.4308768	-63.9950975	Apolinario Saravia, Municipio de Apolinario Saravia, Anta, Salta, Argentina
ARGENTINA	SALTA	Anta	Ceibalito	0	0	0	1	0	0	0	0	0	1	-25.1101879	-64.2752752	Ceibalito, Municipio de Joaquín V. González, Anta, Salta, Argentina
ARGENTINA	SALTA	Anta	Centro 25 de Junio	0	0	0	0	1	1	0	0	0	2			
ARGENTINA	SALTA	Anta	Coronel Mollinedo	0	0	0	0	1	0	0	1	1	3	-24.5399351	-64.1007255	Coronel Mollinedo, Municipio de Apolinario Saravia, Anta, Salta, Argentina
ARGENTINA	SALTA	Anta	Coronel Olleros	0	0	0	0	1	0	0	1	0	2	-25.0993164	-64.2203279	Chañar Muyo, Municipio de Joaquín V. González, Anta, Salta, Argentina
ARGENTINA	SALTA	Anta	El Quebrachal	0	1	0	1	1	1	1	0	1	6	-25.3324035	-64.0176055	Municipio de El Quebrachal, Anta, Salta, Argentina
ARGENTINA	SALTA	Anta	Gaona	0	1	0	1	1	0	1	0	1	5	-25.2413771	-64.0371561	Gaona, Municipio de El Quebrachal, Anta, Salta, Argentina
ARGENTINA	SALTA	Anta	General Pizarro	0	0	0	1	1	0	0	1	1	4	-24.2277683	-63.9897804	General Pizarro, Municipio de General Pizarro, Anta, Salta, Argentina
ARGENTINA	SALTA	Anta	Joaquín V. González	1	1	0	1	1	1	1	0	1	7	-25.117141	-64.1247498	Municipio de Joaquín V. González, Anta, Salta, Argentina
ARGENTINA	SALTA	Anta	Las Lajitas	0	1	0	1	1	1	1	1	1	7	-24.7271243	-64.19432614309838	Las Lajitas, Anta, Salta, Argentina
ARGENTINA	SALTA	Anta	Luis Burela	0	0	0	0	0	0	0	1	0	1	-24.3867004	-63.9900314	Luis Burela, Municipio de General Pizarro, Anta, Salta, Argentina
ARGENTINA	SALTA	Anta	Macapillo	0	0	0	0	0	0	0	0	0	0	-25.4031119	-63.9820685	Macapillo, Municipio de El Quebrachal, Anta, Salta, A4452, Argentina
ARGENTINA	SALTA	Anta	Nuestra Señora de Talavera	0	0	0	0	1	1	0	0	0	2	-25.4605474	-63.7805985	Nuestra Señora de Talavera, Municipio de El Quebrachal, Anta, Salta, Argentina
ARGENTINA	SALTA	Anta	Piquete Cabado	0	0	0	0	0	0	0	1	1	2	-24.8199213	-64.1779238	Piquete Cabado, Municipio de Joaquín V. González, Anta, Salta, Argentina
ARGENTINA	SALTA	Anta	Río del Valle	0	0	0	0	0	0	0	1	1	2	-24.6747866	-64.2001291	Río del Valle, Municipio de Las Lajitas, Anta, Salta, Argentina
ARGENTINA	SALTA	Anta	Tolloche	0	0	0	1	0	0	0	0	1	2	-25.5264141	-63.5225949	Tolloche, Municipio de El Quebrachal, Anta, Salta, Argentina
ARGENTINA	SALTA	Cachi	Cachi	0	0	0	1	1	1	1	1	1	6	-25.1198715	-66.1618911	Cachi, Municipio de Cachi, Cachi, Salta, Argentina
ARGENTINA	SALTA	Cachi	Payogasta	0	0	0	0	1	0	1	1	0	3	-25.0516507	-66.1031482	Payogasta, Municipio de Payogasta, Cachi, Salta, Argentina
ARGENTINA	SALTA	Cafayate	Cafayate	1	0	0	1	1	1	1	1	1	7	-26.071047	-65.9800655	Cafayate, Salta, A4427AHB, Argentina
ARGENTINA	SALTA	Cafayate	Tolombón	0	0	0	0	1	0	0	1	0	2	-26.1827537	-65.9398439	Tolombón, Cafayate, Salta, Argentina
ARGENTINA	SALTA	Capital	Atocha	0	0	0	1	1	1	1	1	0	5			
ARGENTINA	SALTA	Capital	El Tipal - La Almudena	0	0	0	0	1	1	0	1	1	4			
ARGENTINA	SALTA	Capital	La Ciénaga y Barrio San Rafael	0	0	0	0	1	0	0	1	0	2			
ARGENTINA	SALTA	Capital	Las Costas	0	0	0	0	0	1	0	1	0	2			
ARGENTINA	SALTA	Capital	Salta	1	1	1	1	1	1	1	1	1	9	-31.5163075	-68.5374604	Salta y Corrientes, Salta, Concepción, San Juan, Capital, San Juan, 5413, Argentina
ARGENTINA	SALTA	Capital	Villa San Lorenzo	1	1	0	1	1	1	1	1	1	8			
ARGENTINA	SALTA	Cerrillos	Barrio El Congreso	0	0	0	1	1	0	0	0	0	2			
ARGENTINA	SALTA	Cerrillos	Barrio Las Tunas	0	0	0	1	1	0	0	0	0	2	-24.8598948	-65.399418	Bº Los Crespones, Municipio de Cerrillos, San José de los Cerrillos, Salta, A4400, Argentina
ARGENTINA	SALTA	Cerrillos	Barrio Los Olmos	0	0	0	0	0	0	0	0	0	0	-24.8685721	-65.4598133	Bº Privado los Olmos, Bº Privado Los Olmos, Municipio de Cerrillos, San José de los Cerrillos, Salta, A4400, Argentina
ARGENTINA	SALTA	Cerrillos	Barrio Los Pinares	1	0	0	1	0	0	0	1	0	3	-24.8615064	-65.3988352	Bº  Los Pinares, Bº Los Pinares, Municipio de Cerrillos, San José de los Cerrillos, Salta, A4400, Argentina
ARGENTINA	SALTA	Cerrillos	Cerrillos	1	1	0	1	1	1	1	1	1	8	-24.8970543	-65.484497	San José de los Cerrillos, Municipio de Cerrillos, San José de los Cerrillos, Salta, 4403, Argentina
ARGENTINA	SALTA	Cerrillos	La Merced	0	0	0	1	1	1	1	1	1	6	-24.9666704	-65.4889976	La Merced, Municipio de La Merced, San José de los Cerrillos, Salta, Argentina
ARGENTINA	SALTA	Cerrillos	San Agustín	0	0	0	0	0	0	1	1	1	3	-24.9960818	-65.4407854	San Agustín, Municipio de La Merced, San José de los Cerrillos, Salta, Argentina
ARGENTINA	SALTA	Cerrillos	Villa Los Álamos	0	0	0	0	1	1	0	0	0	2			
ARGENTINA	SALTA	Chicoana	Barrio Finca La Maroma	0	0	0	1	0	0	0	0	0	1			
ARGENTINA	SALTA	Chicoana	Barrio La Rotonda	0	0	0	1	0	0	0	1	0	2	-25.0824487	-65.5374513	Barrio La Rotonda, Municipio de Chicoana, Chicoana, Salta, 4423, Argentina
ARGENTINA	SALTA	Chicoana	Barrio Santa Teresita	0	0	0	1	0	0	0	0	0	1			
ARGENTINA	SALTA	Chicoana	Chicoana	1	0	0	1	1	1	1	1	1	7	-25.1047976	-65.5345638	Chicoana, Municipio de Chicoana, Chicoana, Salta, Argentina
ARGENTINA	SALTA	Chicoana	El Carril	1	0	0	1	1	1	1	1	1	7	-25.0732283	-65.4925752	El Carril, Municipio de El Carril, Chicoana, Salta, Argentina
ARGENTINA	SALTA	General Güemes	Campo Santo	1	0	0	1	1	1	1	1	1	7	-24.6819396	-65.1022991	Campo Santo, Municipio de General Güemes, General Güemes, Salta, A4432, Argentina
ARGENTINA	SALTA	General Güemes	Cobos	0	0	0	1	1	0	0	1	0	3	-24.7378262	-65.0846312	Cobos, Municipio de General Güemes, General Güemes, Salta, Argentina
ARGENTINA	SALTA	General Güemes	El Bordo	0	0	0	1	0	0	0	1	0	2	-24.664997149999998	-65.10700340142112	El Bordo, Municipio de Campo Santo, General Güemes, Salta, Argentina
ARGENTINA	SALTA	General Güemes	General Güemes	1	0	0	1	1	1	1	0	1	6	-24.6731874	-65.0440903	General Güemes, Cornejo, General Martín Miguel de Güemes, Municipio de General Güemes, General Güemes, Salta, A4430, Argentina
ARGENTINA	SALTA	Grl. José de San Martín	Aguaray	1	1	0	1	1	0	1	1	1	7			
ARGENTINA	SALTA	Grl. José de San Martín	Campamento Vespucio	1	0	0	1	1	0	1	0	1	5			
ARGENTINA	SALTA	Grl. José de San Martín	Campichuelo	0	0	0	0	1	0	1	0	0	2			
ARGENTINA	SALTA	Grl. José de San Martín	Campo Durán	0	0	0	1	1	0	0	0	0	2			
ARGENTINA	SALTA	Grl. José de San Martín	Capiazuti	0	0	0	0	1	0	0	0	0	1			
ARGENTINA	SALTA	Grl. José de San Martín	Carboncito	0	0	0	0	0	0	0	0	0	0			
ARGENTINA	SALTA	Grl. José de San Martín	Coronel Cornejo	1	0	0	1	1	0	1	0	1	5			
ARGENTINA	SALTA	Grl. José de San Martín	Dragones	0	0	0	1	1	0	1	1	1	5			
ARGENTINA	SALTA	Grl. José de San Martín	Embarcación	1	1	0	1	1	1	1	0	1	7			
ARGENTINA	SALTA	Grl. José de San Martín	General Ballivián	0	0	0	1	1	0	0	0	1	3			
ARGENTINA	SALTA	Grl. José de San Martín	General Mosconi	1	0	0	1	1	1	1	1	1	7			
ARGENTINA	SALTA	Grl. José de San Martín	Hickman	0	0	0	0	1	0	0	0	0	1			
ARGENTINA	SALTA	Grl. José de San Martín	Misión Chaqueña	0	0	0	0	1	0	0	0	0	1			
ARGENTINA	SALTA	Grl. José de San Martín	Misión El Cruce - El Milagro - El Jardín de San Martín	0	0	0	0	1	1	0	0	0	2			
ARGENTINA	SALTA	Grl. José de San Martín	Misión Kilómetro 6	0	0	0	0	0	0	0	0	0	0			
ARGENTINA	SALTA	Grl. José de San Martín	Misión Tierras Fiscales	0	0	0	0	0	0	0	0	0	0			
ARGENTINA	SALTA	Grl. José de San Martín	Pacará	0	0	0	0	0	0	0	0	0	0			
ARGENTINA	SALTA	Grl. José de San Martín	Padre Lozano	0	0	0	0	1	0	0	0	0	1			
ARGENTINA	SALTA	Grl. José de San Martín	Piquirenda	0	0	0	1	0	0	0	0	0	1			
ARGENTINA	SALTA	Grl. José de San Martín	Profesor Salvador Mazza	1	0	0	1	1	1	1	0	1	6			
ARGENTINA	SALTA	Grl. José de San Martín	Recaredo	0	0	0	0	0	0	0	0	0	0			
ARGENTINA	SALTA	Grl. José de San Martín	Tartagal	1	1	0	1	1	1	1	1	1	8			
ARGENTINA	SALTA	Grl. José de San Martín	Tobantirenda	0	0	0	1	0	0	0	0	0	1			
ARGENTINA	SALTA	Grl. José de San Martín	Tranquitas	0	0	0	0	0	0	0	0	0	0			
ARGENTINA	SALTA	Grl. José de San Martín	Yacuy	0	0	0	1	1	0	0	0	0	2			
ARGENTINA	SALTA	Guachipas	Guachipas	0	0	0	1	1	0	1	1	1	5	-25.52216765	-65.50833590121181	Guachipas, Salta, Argentina
ARGENTINA	SALTA	Iruya	Iruya	0	0	0	1	0	0	1	1	0	3	-22.8788916	-65.2215875	Río Iruya (Río Colanzulí), Colanzulí, Municipio Iruya, Departamento Iruya, Salta, Argentina
ARGENTINA	SALTA	Iruya	Isla de Cañas	0	0	0	0	1	0	1	1	0	3	-22.8992048	-64.6655331	Isla de Cañas, Municipio Isla de Cañas, Departamento Iruya, Salta, Argentina
ARGENTINA	SALTA	Iruya	Pueblo Viejo	0	0	0	1	0	0	1	0	0	2	-22.8372669	-65.2142794	Pueblo Viejo, Municipio Iruya, Departamento Iruya, Salta, 4633, Argentina
ARGENTINA	SALTA	La Caldera	La Caldera	0	0	0	1	1	1	1	1	1	6	-24.6026292	-65.3806378	La Caldera, Municipio de La Caldera, La Caldera, Salta, Argentina
ARGENTINA	SALTA	La Caldera	Vaqueros	1	0	0	1	1	1	1	1	0	6	-24.6907536	-65.4096364	Vaqueros, Municipio de Vaqueros, La Caldera, Salta, Argentina
ARGENTINA	SALTA	La Candelaria	El Jardín	0	0	0	1	1	0	1	0	1	4	-26.08062	-65.3940654	El Jardín, Municipio de El Jardín, La Candelaria, Salta, Argentina
ARGENTINA	SALTA	La Candelaria	El Tala	0	0	0	1	1	1	1	1	1	6	-26.1104193	-65.2778439	El Tala, Municipio de El Tala, La Candelaria, Salta, Argentina
ARGENTINA	SALTA	La Candelaria	La Candelaria	0	0	0	1	1	0	1	0	0	3	-26.1277478	-65.0502418	La Candelaria, Municipio de La Candelaria, La Candelaria, Salta, Argentina
ARGENTINA	SALTA	La Poma	Cobres	0	0	0	0	0	0	0	0	0	0	-23.64980365	-66.28776977596897	Cobres, Municipio de La Poma, Departemento La Poma, Salta, Argentina
ARGENTINA	SALTA	La Poma	La Poma	0	0	0	1	0	0	0	1	0	2	-24.7240515	-66.20043389757419	La Poma, Ciudad vieja, Municipio de La Poma, Departemento La Poma, Salta, Argentina
ARGENTINA	SALTA	La Viña	Ampascachi	0	0	0	0	0	0	0	1	0	1	-25.3525654	-65.5283426	Ampascachi, Municipio de La Viña, La Viña, Salta, Argentina
ARGENTINA	SALTA	La Viña	Cabra Corral	0	0	0	0	1	0	0	1	0	2	-25.2821246	-65.4389869	Cabra Corral, Municipio de La Viña, La Viña, Salta, A4421, Argentina
ARGENTINA	SALTA	La Viña	Coronel Moldes	1	0	0	0	1	1	1	1	1	6	-25.2800123	-65.4787456	Coronel Moldes, Municipio de Coronel Moldes, La Viña, Salta, Argentina
ARGENTINA	SALTA	La Viña	La Viña	0	0	0	1	1	0	1	1	1	5	-25.4670565	-65.5663944	La Viña, Municipio de La Viña, La Viña, Salta, Argentina
ARGENTINA	SALTA	La Viña	Talapampa	0	0	0	0	0	0	0	1	0	1	-25.5448916	-65.5650041	Talapampa, Municipio de La Viña, La Viña, Salta, Argentina
ARGENTINA	SALTA	Los Andes	Olacapato	0	0	0	1	0	0	1	1	1	4	-24.1611457	-66.757304	Cerro Olacapato Grande, Municipio de San Antonio de los Cobres, Los Andes, Salta, Argentina
ARGENTINA	SALTA	Los Andes	San Antonio de los Cobres	0	0	0	1	1	0	1	1	1	5	-24.2174255	-66.3196946	Municipio de San Antonio de los Cobres, Los Andes, Salta, Argentina
ARGENTINA	SALTA	Los Andes	Santa Rosa de los Pastos Grandes	0	0	0	1	0	0	0	1	1	3	-24.4669515	-66.6736998	Santa Rosa de los Pastos Grandes, Municipio de San Antonio de los Cobres, Los Andes, Salta, A4411, Argentina
ARGENTINA	SALTA	Los Andes	Tolar Grande	0	0	0	1	1	0	1	1	1	5	-24.5894782	-67.3966467	Municipio de Tolar Grande, Los Andes, Salta, Argentina
ARGENTINA	SALTA	Metán	El Galpón	1	0	0	1	1	1	1	0	1	6	-25.3806631	-64.6515946	Municipio de El Galpón, San José de Metán, Salta, 4444, Argentina
ARGENTINA	SALTA	Metán	El Tunal	0	0	0	1	1	0	0	0	1	3	-25.253895	-64.395205	El Tunal, Municipio de El Galpón, San José de Metán, Salta, Argentina
ARGENTINA	SALTA	Metán	Lumbreras	0	0	0	1	0	0	0	0	0	1	-25.2111337	-64.9273049	Lumbreras, Municipio de Río Piedras, San José de Metán, Salta, Argentina
ARGENTINA	SALTA	Metán	Metán Viejo	0	0	0	1	1	0	0	0	1	3	-25.532203	-64.9742189	Metán Viejo, Municipio de Metán, San José de Metán, Salta, 4440, Argentina
ARGENTINA	SALTA	Metán	Presa El Tunal	0	0	0	0	0	0	0	0	0	0	-25.23875635	-64.47497486551953	Presa General Martín Miguel de Güemes, Municipio de El Galpón, San José de Metán, Salta, Argentina
ARGENTINA	SALTA	Metán	Río Piedras	1	0	0	1	1	1	1	0	1	6	-25.3462169	-65.0039143	Río Piedras, Municipio de Río Piedras, San José de Metán, Salta, Argentina
ARGENTINA	SALTA	Metán	San José de Metán	1	0	0	1	1	1	1	0	1	6	-25.4971644	-64.9709701	Metán, Municipio de Metán, San José de Metán, Salta, 4440, Argentina
ARGENTINA	SALTA	Metán	San José de Orquera	0	0	0	1	0	0	0	0	0	1			
ARGENTINA	SALTA	Molinos	La Puerta	0	0	0	0	0	0	1	0	0	1	-25.2799769	-66.4498863	La Puerta, Municipio de Molinos, Molinos, Salta, Argentina
ARGENTINA	SALTA	Molinos	Molinos	1	0	0	1	1	0	1	1	0	5	-25.4371092	-66.2945633	Municipio de Molinos, Molinos, Salta, Argentina
ARGENTINA	SALTA	Molinos	Seclantás	0	0	0	1	1	0	1	1	1	5	-25.3315523	-66.2442988	Seclantás, Municipio de Seclantás, Molinos, Salta, 4419, Argentina
ARGENTINA	SALTA	Orán	Aguas Blancas	0	0	0	0	1	0	1	1	1	4	-22.7353211	-64.3543768	Aguas Blancas, Municipio de Aguas Blancas, Orán, Salta, Argentina
ARGENTINA	SALTA	Orán	Colonia Santa Rosa	0	1	0	0	1	1	1	1	1	6	-23.3940062	-64.425791	Colonia Santa Rosa, Municipio de Colonia Santa Rosa, Orán, Salta, Argentina
ARGENTINA	SALTA	Orán	El Tabacal	0	0	0	1	1	0	1	0	0	3	-23.2559354	-64.2466095	El Tabacal, Municipio de Hipólito Yrigoyen, Orán, Salta, Argentina
ARGENTINA	SALTA	Orán	Hipólito Yrigoyen	1	1	0	1	1	1	1	1	1	8	-23.2443133	-64.276584	Hipólito Yrigoyen, Municipio de Hipólito Yrigoyen, Orán, Salta, Argentina
ARGENTINA	SALTA	Orán	La Misión	0	0	0	0	0	0	0	0	0	0	-23.3723759	-64.4298256	Barrio La Misión Bautista, Municipio de Colonia Santa Rosa, Orán, Salta, Argentina
ARGENTINA	SALTA	Orán	Pichanal	1	1	0	1	1	1	1	0	1	7	-23.3220599	-64.2269308	Pichanal, Municipio de Pichanal, Orán, Salta, 4534, Argentina
ARGENTINA	SALTA	Orán	San Ramón de la Nueva Orán	1	0	0	1	1	1	1	0	1	6	-23.136084	-64.3230702	San Ramón de la Nueva Orán, Municipio de San Ramón de la Nueva Orán, Orán, Salta, 4530, Argentina
ARGENTINA	SALTA	Orán	Urundel	0	0	0	1	1	1	1	1	1	6	-23.5582035	-64.3978211	Urundel, Municipio de Urundel, Orán, Salta, 4542, Argentina
ARGENTINA	SALTA	Rivadavia	Alto de la Sierra	0	0	0	1	0	0	0	1	0	2	-22.7368994	-62.4986352	Alto de la Sierra, Municipio de Rivadavia Banda Norte, Rivadavia, Salta, Argentina
ARGENTINA	SALTA	Rivadavia	Capitán Juan Pagé	0	0	0	0	0	0	0	1	0	1	-23.6883367	-62.3743161	Capitán Juan Pagé, Municipio de Rivadavia Banda Norte, Rivadavia, Salta, Argentina
ARGENTINA	SALTA	Rivadavia	Coronel Juan Solá	1	0	0	1	1	1	1	1	1	7	-23.4730612	-62.88798104818426	Coronel Juan Solá, Municipio de Rivadavia Banda Norte, Rivadavia, Salta, Argentina
ARGENTINA	SALTA	Rivadavia	Hito 1	0	0	0	0	0	0	0	0	0	0	-21.9996936	-62.823869	Hito 1, Municipio de Santa Victoria Este, Rivadavia, Salta, Argentina
ARGENTINA	SALTA	Rivadavia	La Unión	0	0	0	0	1	0	0	0	0	1	-23.8968436	-63.1968718	La Unión, Municipio de Rivadavia Banda Sur, Rivadavia, Salta, Argentina
ARGENTINA	SALTA	Rivadavia	Los Blancos	0	0	0	0	1	0	0	1	0	2	-23.6091595	-62.5947302	Los Blancos, Municipio de Rivadavia Banda Norte, Rivadavia, Salta, Argentina
ARGENTINA	SALTA	Rivadavia	Pluma de Pato	0	0	0	0	1	0	0	1	0	2	-23.3705136	-63.094872	Pluma de Pato, Municipio de Rivadavia Banda Norte, Rivadavia, Salta, Argentina
ARGENTINA	SALTA	Rivadavia	Rivadavia	0	0	0	1	1	0	0	0	1	3	-24.183333	-62.883333	Rivadavia, Municipio de Rivadavia Banda Sur, Rivadavia, Salta, Argentina
ARGENTINA	SALTA	Rivadavia	Santa María	0	0	0	0	0	0	0	0	0	0	-22.1537884	-62.8088049	Santa María, Municipio de Santa Victoria Este, Rivadavia, Salta, Argentina
ARGENTINA	SALTA	Rivadavia	Santa Rosa	0	0	0	0	0	0	0	0	0	0	-24.0261839	-63.0829406	Santa Rosa, Municipio de Rivadavia Banda Sur, Rivadavia, Salta, Argentina
