Pais	Provincia	Partido	Localidad	ADSL	Cablemódem	Dial Up	Fibra óptica	4G	3G	Telefonía Fija	Wireless	Satelital	Total	Latitude	Longitude	location
ARGENTINA	ENTRE RIOS	Tala	Maciá	0	1	0	0	1	1	1	1	0	5	-32.1721133	-59.395944	Maciá, Distrito Raíces al Sur, Departamento Tala, Entre Ríos, Argentina
ARGENTINA	ENTRE RIOS	Tala	Rosario del Tala	1	0	0	1	1	1	1	0	0	5	-32.3008178	-59.138887	Rosario del Tala, Distrito Pueblo Segundo, Departamento Tala, Entre Ríos, E3174ZAA, Argentina
ARGENTINA	ENTRE RIOS	Uruguay	1º de Mayo	0	0	0	0	0	0	1	1	0	2	-32.2555047	-58.4231595	Primero de Mayo, Municipio de Primero de Mayo, Distrito Molino, Departamento Uruguay, Entre Ríos, Argentina
ARGENTINA	ENTRE RIOS	Uruguay	Basavilbaso	1	0	0	1	1	0	1	1	1	6	-32.3743512	-58.8830126	Basavilbaso, Distrito Moscas, Departamento Uruguay, Entre Ríos, Argentina
ARGENTINA	ENTRE RIOS	Uruguay	Caseros	1	0	0	1	1	1	1	1	0	6	-32.4630367	-58.4787009	Colonia Caseros, Caseros, Distrito Molino, Departamento Uruguay, Entre Ríos, Argentina
ARGENTINA	ENTRE RIOS	Uruguay	Colonia Elía	0	0	0	1	1	0	1	1	0	4	-32.6706265	-58.3252464	Colonia Elía, Municipio de Colonia Elía, Distrito Potrero, Departamento Uruguay, Entre Ríos, Argentina
ARGENTINA	ENTRE RIOS	Uruguay	Concepción del Uruguay	1	1	1	1	1	1	1	1	0	8	-32.4851849	-58.2320232	Concepción del Uruguay, Distrito Molino, Departamento Uruguay, Entre Ríos, Argentina
ARGENTINA	ENTRE RIOS	Uruguay	Estancia San Pedro	0	0	0	0	0	0	0	1	0	1	-32.2665384	-58.6311269	Estancia San Pedro, Junta de Gobierno de Arroyo Gena, Distrito Gená, Departamento Uruguay, Entre Ríos, Argentina
ARGENTINA	ENTRE RIOS	Uruguay	Herrera	1	0	0	0	1	0	1	1	0	4	-32.4336934	-58.6349987	Herrera, Distrito Gená, Departamento Uruguay, Entre Ríos, Argentina
ARGENTINA	ENTRE RIOS	Uruguay	Las Moscas	0	0	0	1	1	0	1	1	0	4	-32.090978	-58.9569427	Las Moscas, Junta de Gobierno de Las Moscas, Distrito Moscas, Departamento Uruguay, Entre Ríos, Argentina
ARGENTINA	ENTRE RIOS	Uruguay	Líbaros	0	0	0	0	0	0	1	1	0	2	-32.2623977	-58.9064648	Líbaros, Junta de Gobierno de Estación Líbaros, Distrito Genacito, Departamento Uruguay, Entre Ríos, Argentina
ARGENTINA	ENTRE RIOS	Uruguay	Pronunciamiento	0	0	0	0	1	1	1	1	0	4	-32.3461055	-58.4439922	Pronunciamiento, Municipio de Pronunciamiento, Distrito Molino, Departamento Uruguay, Entre Ríos, Argentina
ARGENTINA	ENTRE RIOS	Uruguay	Rocamora	0	0	0	0	0	0	1	1	0	2	-32.343262	-58.9689711	Rocamora, Junta de Gobierno de Rocamora, Distrito Moscas, Departamento Uruguay, Entre Ríos, 3172, Argentina
ARGENTINA	ENTRE RIOS	Uruguay	Santa Anita	0	0	0	1	1	0	1	1	0	4	-32.1744651	-58.7861233	Santa Anita, Municipio de Santa Anita, Distrito Genacito, Departamento Uruguay, Entre Ríos, Argentina
ARGENTINA	ENTRE RIOS	Uruguay	Villa Mantero	1	0	0	1	1	1	1	1	1	7	-32.3974055	-58.7462579	Villa Mantero, Distrito Genacito, Departamento Uruguay, Entre Ríos, Argentina
ARGENTINA	ENTRE RIOS	Uruguay	Villa San Justo	0	0	0	1	1	1	1	1	0	5	-32.4457963	-58.4352331	San Justo, Municipio de San Justo, Distrito Molino, Departamento Uruguay, Entre Ríos, E3262, Argentina
ARGENTINA	ENTRE RIOS	Uruguay	Villa San Marcial (Est. Gobernador Urquiza)	0	0	0	0	1	1	1	1	0	4			
ARGENTINA	ENTRE RIOS	Victoria	Antelo	0	0	0	0	0	0	0	0	0	0	-32.5334749	-60.0356942	Antelo, Distrito Corrales, Departamento Victoria, Entre Ríos, Argentina
ARGENTINA	ENTRE RIOS	Victoria	Charigüé	0	0	0	0	0	0	0	0	0	0	-32.9359002	-60.6013493	Charigüé, Victoria, Distrito Secciones, Departamento Victoria, Entre Ríos, Argentina
ARGENTINA	ENTRE RIOS	Victoria	Laguna del Pescado	0	0	0	0	0	0	0	0	0	0	-32.7118207	-60.0557542	Laguna del Pescado, Distrito Laguna del Pescado, Departamento Victoria, Entre Ríos, Argentina
ARGENTINA	ENTRE RIOS	Victoria	Molino Doll	0	0	0	0	1	0	1	1	0	3	-32.3069907	-60.4218419	Molino Doll, Distrito Rincón del Doll, Departamento Victoria, Entre Ríos, Argentina
ARGENTINA	ENTRE RIOS	Victoria	Rincón de Nogoyá	0	0	0	0	1	0	1	1	0	3	-32.7804173	-59.907618	Rincón de Nogoyá, Junta de Gobierno de Rincón de Nogoyá, Distrito Rincón de Nogoyá, Departamento Victoria, Entre Ríos, 3155, Argentina
ARGENTINA	ENTRE RIOS	Victoria	Victoria	1	1	0	1	1	1	1	1	0	7	-32.6217981	-60.1576895	Victoria, Distrito Laguna del Pescado, Departamento Victoria, Entre Ríos, E3153ZAA, Argentina
ARGENTINA	ENTRE RIOS	Villaguay	Estación Raíces	1	0	0	0	1	0	1	1	0	4	-31.9091478	-59.2606838	Raíces, Junta de Gobierno de Estación Raíces, Distrito Raíces, Departamento Villaguay, Entre Ríos, Argentina
ARGENTINA	ENTRE RIOS	Villaguay	Ingeniero Miguel Sajaroff	0	0	0	0	0	0	1	1	0	2	-31.956923	-58.8491358	Ingeniero Sajaroff, Distrito Bergara, Departamento Villaguay, Entre Ríos, Argentina
ARGENTINA	ENTRE RIOS	Villaguay	Jubileo	0	0	0	1	1	0	1	1	0	4	-31.7343684	-58.6333764	Jubileo, Junta de Gobierno de Jubileo, Distrito Bergara, Departamento Villaguay, Entre Ríos, Argentina
ARGENTINA	ENTRE RIOS	Villaguay	Mojones Norte	0	0	0	0	1	0	0	0	0	1	-31.4992755	-59.2124463	Mojones Norte, Junta de Gobierno de Mojones Norte, Distrito Mojones Norte, Departamento Villaguay, Entre Ríos, Argentina
ARGENTINA	ENTRE RIOS	Villaguay	Paso de la Laguna	0	0	0	1	0	0	0	1	0	2	-31.8020814	-59.1600682	Paso de la Laguna, Junta de Gobierno de Paso de la Laguna, Distrito Raíces, Departamento Villaguay, Entre Ríos, Argentina
ARGENTINA	ENTRE RIOS	Villaguay	Villa Clara	1	0	0	1	1	1	1	1	1	7	-31.8294435	-58.8214775	Villa Clara, Distrito Bergara, Departamento Villaguay, Entre Ríos, Argentina
ARGENTINA	ENTRE RIOS	Villaguay	Villa Domínguez	0	0	0	1	1	1	1	1	0	5	-31.9862975	-58.9616139	Villa Domínguez, Distrito Bergara, Departamento Villaguay, Entre Ríos, 3246, Argentina
ARGENTINA	ENTRE RIOS	Villaguay	Villaguay	1	0	0	1	1	1	1	1	0	6	-31.86613015	-59.027373719119936	Villaguay, San Martín, Villaguay, Distrito Lucas al Sud, Departamento Villaguay, Entre Ríos, 3240, Argentina
ARGENTINA	FORMOSA	Bermejo	Fortín Soledad	0	0	0	0	0	0	0	1	0	1	-24.1510341	-60.6911594	Fortín La Soledad, Departamento Bermejo, Formosa, Argentina
ARGENTINA	FORMOSA	Bermejo	Guadalcazar	0	0	0	0	0	0	0	1	0	1	-23.6712884	-61.1632278	Guadalcazar, Departamento Bermejo, Formosa, Argentina
ARGENTINA	FORMOSA	Bermejo	La Rinconada	0	0	0	0	0	0	0	1	0	1	-23.7531461	-61.2668749	La Rinconada, Departamento Bermejo, Formosa, Argentina
ARGENTINA	FORMOSA	Bermejo	Laguna Yema	0	0	0	0	1	1	1	1	1	5	-24.2539494	-61.2423018	Laguna Yema, Municipio de Laguna Yema, Departamento Bermejo, Formosa, Argentina
ARGENTINA	FORMOSA	Bermejo	Lamadrid	0	0	0	0	0	0	0	1	0	1	-23.8971749	-60.7553879	Lamadrid, Departamento Bermejo, Formosa, Argentina
ARGENTINA	FORMOSA	Bermejo	Los Chiriguanos	0	0	0	0	1	0	1	1	0	3	-24.098912	-61.4618276	Los Chiriguanos, Municipio de Los Chiriguanos, Departamento Bermejo, Formosa, Argentina
ARGENTINA	FORMOSA	Bermejo	Pozo de Maza	0	0	0	0	0	0	0	1	1	2	-23.5709595	-61.707022	Pozo de Maza, Municipio de Pozo de Maza, Departamento Bermejo, Formosa, Argentina
ARGENTINA	FORMOSA	Bermejo	Pozo del Mortero	0	0	0	0	1	0	0	1	0	2	-24.4031455	-61.0321492	Pozo del Mortero, Municipio de Pozo del Mortero, Departamento Bermejo, Formosa, Argentina
ARGENTINA	FORMOSA	Bermejo	Vaca Perdida	0	0	0	0	0	0	0	1	0	1	-23.4996267	-61.6487882	Vaca Perdida, Departamento Bermejo, Formosa, Argentina
ARGENTINA	FORMOSA	Formosa	Colonia Pastoril	0	0	0	0	1	0	0	1	0	2	-25.6742289	-58.2629062	Colonia Pastoril, Municipio de Colonia Pastoril, Departamento Formosa, Formosa, Argentina
ARGENTINA	FORMOSA	Formosa	Formosa	1	1	0	1	1	1	1	1	1	8	-26.1852983	-58.1744976	Municipio de Formosa, Departamento Formosa, Formosa, Argentina
ARGENTINA	FORMOSA	Formosa	Gran Guardia	0	0	0	0	1	0	1	1	0	3	-25.8631725	-58.8850201	Gran Guardia, Municipio de Gran Guardia, Departamento Formosa, Formosa, Argentina
ARGENTINA	FORMOSA	Formosa	Mariano Boedo	0	0	0	0	0	0	0	1	0	1	-26.109286	-58.4870998	Mariano Boedo, Municipio de Mariano Boedo, Departamento Formosa, Formosa, Argentina
ARGENTINA	FORMOSA	Formosa	Mojón de Fierro	0	0	0	0	1	1	0	1	1	4	-26.0400222	-58.0534984	Mojón de Fierro, Municipio de Mojón de Fierro, Departamento Formosa, Formosa, Argentina
ARGENTINA	FORMOSA	Formosa	San Hilario	0	0	0	0	1	0	1	1	1	4	-26.0275164	-58.6513938	San Hilario, Municipio de San Hilario, Departamento Formosa, Formosa, Argentina
ARGENTINA	FORMOSA	Formosa	Villa del Carmen	0	0	0	1	1	1	0	1	1	5	-25.7330022	-59.1112601	Villa del Carmen, Pirané, Municipio de Pirané, Departamento Pirané, Formosa, 3606, Argentina
ARGENTINA	FORMOSA	Formosa	Villa Trinidad	0	0	0	0	0	0	0	0	0	0	-26.2191192	-58.2829307	Villa Trinidad, Municipio de Formosa, Departamento Formosa, Formosa, P3600, Argentina
ARGENTINA	FORMOSA	Laishi	Banco Payaguá	0	0	0	0	0	0	0	1	0	1	-26.7076633	-58.3370913	Banco Payaguá, Municipio de Banco Payaguá, Departamento Laishi, Formosa, Argentina
ARGENTINA	FORMOSA	Laishi	General Lucio Victorio Mansilla	1	0	0	0	1	0	1	1	1	5			
ARGENTINA	FORMOSA	Laishi	Herradura	0	0	0	0	1	0	1	1	0	3	-26.4892536	-58.311546	Herradura, Municipio de Herradura, Departamento Laishi, Formosa, P3601, Argentina
ARGENTINA	FORMOSA	Laishi	San Francisco de Laishi	0	0	0	0	1	1	1	1	1	5	-26.2439679	-58.6297373	San Francisco de Laishí, Municipio Misión San Francisco de Laishi, Departamento Laishi, Formosa, Argentina
ARGENTINA	FORMOSA	Laishi	Tatané	0	0	0	0	1	0	0	1	0	2	-26.3977434	-58.354324258544814	Tatané, Municipio de Tatané, Departamento Laishi, Formosa, Argentina
ARGENTINA	FORMOSA	Laishi	Villa Escolar	0	0	0	0	0	0	0	1	0	1	-26.6218505	-58.6699675	Villa Escolar, Municipio de Villa Escolar, Departamento Laishi, Formosa, P3526, Argentina
ARGENTINA	FORMOSA	Matacos	Ingeniero Guillermo N. Juárez	1	0	0	0	1	1	1	1	1	6	-23.8985027	-61.851527	Municipalidad de Ingeniero Juarez, Salta, Barrio San Cayetano, Ingeniero Juárez, Municipio de Ingeniero Juárez, Departamento Matacos, Formosa, 3636, Argentina
ARGENTINA	FORMOSA	Patiño	Bartolomé de las Casas	0	0	0	0	0	0	0	1	1	2	-25.4075386	-59.5714141	Bartolomé de las Casas, Municipio de Bartolomé de las Casas, Departamento Patiño, Formosa, Argentina
ARGENTINA	FORMOSA	Patiño	Colonia Sarmiento	0	0	0	0	0	0	0	0	0	0	-24.6435882	-59.4325227	Colonia Sarmiento, Municipio de Colonia Sarmiento, Departamento Patiño, Formosa, Argentina
ARGENTINA	FORMOSA	Patiño	Comandante Fontana	0	0	0	0	1	1	1	1	0	4	-25.3335851	-59.6848511	Comandante Fontana, Municipio de Comandante Fontana, Departamento Patiño, Formosa, 3620, Argentina
ARGENTINA	FORMOSA	Patiño	El Recreo	0	0	0	0	0	0	0	0	0	0	-25.0402323	-59.2867756	El Recreo, Municipio de El Recreo, Departamento Patiño, Formosa, Argentina
ARGENTINA	FORMOSA	Patiño	Estanislao del Campo	1	0	0	0	1	0	1	1	0	4	-25.0535003	-60.0924862	Estanislao del Campo, Municipio de Estanislao del Campo, Departamento Patiño, Formosa, P3626, Argentina
ARGENTINA	FORMOSA	Patiño	Fortín Cabo 1º Lugones	0	0	0	0	1	0	0	1	0	2			
ARGENTINA	FORMOSA	Patiño	Fortín Sargento 1º Leyes	0	0	0	0	0	0	0	1	0	1	-24.5541963	-59.385114	Fortín Sargento Primero Leyes, Municipio de Fortín Sargento Primero Leyes, Departamento Patiño, Formosa, Argentina
ARGENTINA	FORMOSA	Patiño	Ibarreta	1	0	0	0	1	1	1	1	1	6	-25.2101601	-59.859911	Ibarreta, Municipio de Ibarreta, Departamento Patiño, Formosa, Argentina
ARGENTINA	FORMOSA	Patiño	Juan G. Bazán	0	0	0	0	1	0	0	1	0	2	-24.542241	-60.8312035	Juan G. Bazán, Municipio de Juan G. Bazán, Departamento Patiño, Formosa, Argentina
ARGENTINA	FORMOSA	Patiño	Las Lomitas	1	0	0	1	1	1	1	1	1	7	-24.7075268	-60.5942732	Las Lomitas, Municipio de Las Lomitas, Departamento Patiño, Formosa, P3630, Argentina
ARGENTINA	FORMOSA	Patiño	Posta Cambio Zalazar	0	0	0	0	1	0	0	1	0	2	-24.2114832	-60.1954676	Posta Cambio Zalazar, Municipio de Posta Cambio Zalazar, Departamento Patiño, Formosa, Argentina
ARGENTINA	FORMOSA	Patiño	Pozo del Tigre	1	0	0	1	1	1	1	1	1	7	-24.8957726	-60.319435	Pozo del Tigre, Municipio de Pozo del Tigre, Departamento Patiño, Formosa, 3628, Argentina
ARGENTINA	FORMOSA	Patiño	San Martín I	0	0	0	0	0	0	0	1	0	1	-24.7548456	-59.4837979	San Martín, Villa General Güemes, Municipio de Villa General Güemes, Departamento Patiño, Formosa, Argentina
ARGENTINA	FORMOSA	Patiño	San Martín II	0	0	0	1	1	0	1	1	0	4	-24.7548456	-59.4837979	San Martín, Villa General Güemes, Municipio de Villa General Güemes, Departamento Patiño, Formosa, Argentina
ARGENTINA	FORMOSA	Patiño	Subteniente Perín	0	0	0	0	1	0	0	1	1	3	-25.5354161	-60.0198124	Subteniente Perín, Municipio de Subteniente Perín, Departamento Patiño, Formosa, Argentina
ARGENTINA	FORMOSA	Patiño	Villa General Güemes	0	0	0	1	1	0	1	1	0	4	-24.7523116	-59.4915189	Villa General Güemes, Municipio de Villa General Güemes, Departamento Patiño, Formosa, Argentina
ARGENTINA	FORMOSA	Patiño	Villa General Manuel Belgrano	0	0	0	1	1	0	1	1	0	4	-24.9384206	-59.0265038	Villa General Manuel Belgrano, Municipio de Villa General Manuel Belgrano, Departamento Patiño, Formosa, P3615, Argentina
ARGENTINA	FORMOSA	Pilagás	Buena Vista	0	0	0	1	1	0	1	1	0	4	-25.0696434	-58.3861353	Buena Vista, Municipio de Buena Vista, Departamento Pilagás, Formosa, 3615, Argentina
ARGENTINA	FORMOSA	Pilagás	El Espinillo	0	0	0	0	1	1	1	1	0	4	-24.9814273	-58.5530004	El Espinillo, Municipio de El Espinillo, Departamento Pilagás, Formosa, Argentina
ARGENTINA	FORMOSA	Pilagás	Laguna Gallo	0	0	0	0	0	0	0	1	1	2	-25.2681582	-58.742106	Laguna Gallo, Municipio de Laguna Gallo, Departamento Pilagás, Formosa, Argentina
ARGENTINA	FORMOSA	Pilagás	Misión Tacaagle	0	0	0	0	1	0	1	1	0	3	-24.9771424	-58.8223443	Misión Tacaaglé, Municipio de Misión Tacaaglé, Departamento Pilagás, Formosa, P3615, Argentina
ARGENTINA	FORMOSA	Pilagás	Portón Negro	0	0	0	0	0	0	0	0	1	1	-24.9661535	-58.7426246	Portón Negro, Municipio de Portón Negro, Departamento Pilagás, Formosa, P3615, Argentina
ARGENTINA	FORMOSA	Pilagás	Tres Lagunas	1	0	0	0	1	0	1	1	0	4	-25.2160881	-58.5130073	Tres Lagunas, Municipio de Tres Lagunas, Departamento Pilagás, Formosa, Argentina
ARGENTINA	FORMOSA	Pilcomayo	Clorinda	1	1	0	1	1	1	1	1	1	8	-25.2900303	-57.7125898	Clorinda, Municipio de Clorinda, Departamento Pilcomayo, Formosa, 3610, Argentina
ARGENTINA	FORMOSA	Pilcomayo	Laguna Blanca	1	0	0	1	1	1	1	1	0	6	-25.1300079	-58.2456194	Laguna Blanca, Municipio de Laguna Blanca, Departamento Pilcomayo, Formosa, Argentina
ARGENTINA	FORMOSA	Pilcomayo	Laguna Naick-Neck	1	0	0	0	1	0	1	1	1	5	-25.2561704	-58.15516445861551	Laguna Naick - Neck, Departamento Pilcomayo, Formosa, Argentina
ARGENTINA	FORMOSA	Pilcomayo	Palma Sola	0	0	0	0	1	0	0	1	0	2	-25.2480777	-57.9789733	Palma Sola, Municipio de Palma Sola, Departamento Pilcomayo, Formosa, Argentina
ARGENTINA	FORMOSA	Pilcomayo	Puerto Pilcomayo	0	0	0	0	0	0	0	1	0	1	-25.3725829	-57.6519799	Puerto Pilcomayo, Municipio de Clorinda, Departamento Pilcomayo, Formosa, Argentina
ARGENTINA	FORMOSA	Pilcomayo	Riacho He-He	0	0	0	1	1	1	1	1	0	5	-25.3617642	-58.2788879	Riacho He-Hé, Municipio de Riacho He-He, Departamento Pilcomayo, Formosa, Argentina
ARGENTINA	FORMOSA	Pilcomayo	Riacho Negro	0	0	0	0	1	0	0	1	0	2	-25.472453	-57.7729536	Riacho Negro, Departamento Pilcomayo, Formosa, Argentina
ARGENTINA	FORMOSA	Pilcomayo	Siete Palmas	1	0	0	1	1	0	1	1	0	5	-25.2036719	-58.3319785	Siete Palmas, Municipio de Siete Palmas, Departamento Pilcomayo, Formosa, Argentina
ARGENTINA	FORMOSA	Pirané	Colonia Campo Villafañe	0	0	0	1	1	0	1	1	0	4			
ARGENTINA	FORMOSA	Pirané	El Colorado	1	0	0	1	1	0	1	1	1	6	-26.3083815	-59.3720661	El Colorado, Municipio de El Colorado, Departamento Pirané, Formosa, P3603, Argentina
ARGENTINA	FORMOSA	Pirané	Palo Santo	0	1	0	0	1	1	1	1	1	6	-25.5644541	-59.3376622	Palo Santo, Municipio de Palo Santo, Departamento Pirané, Formosa, P3608, Argentina
ARGENTINA	FORMOSA	Pirané	Pirané	0	0	0	1	1	1	0	1	1	5	-25.7267008	-59.1027338	Pirané, Avenida 9 de Julio, San Jose Obrero, Pirané, Municipio de Pirané, Departamento Pirané, Formosa, 3606, Argentina
ARGENTINA	FORMOSA	Pirané	Villa Kilómetro 213	0	0	0	0	1	0	1	1	0	3	-26.1839081	-59.3665574	Escuela Provincial de Educación Primaria 54 Flota Naval Argentina, 165, Néstor Kirchner, Villa Dos Trece, Municipio de Villa Dos Trece, Departamento Pirané, Formosa, 3602, Argentina
ARGENTINA	FORMOSA	Ramón Lista	El Potrillo	0	0	0	0	0	0	0	1	0	1	-23.1605594	-62.0068445	El Potrillo, Municipio de El Potrillo, Departamento Ramón Lista, Formosa, Argentina
ARGENTINA	FORMOSA	Ramón Lista	El Quebracho	0	0	0	0	0	0	0	1	0	1	-23.3406838	-61.8726506	El Quebracho, Departamento Ramón Lista, Formosa, Argentina
ARGENTINA	FORMOSA	Ramón Lista	General Mosconi	0	0	0	1	0	0	1	1	1	4			
ARGENTINA	JUJUY	Cochinoca	Abdón Castro Tolay	0	0	0	0	0	0	0	0	0	0	-23.3420099	-66.0914002	Municipio de Abdón Castro Tolay, Departamento Cochinoca, Jujuy, J4641, Argentina
ARGENTINA	JUJUY	Cochinoca	Abra Pampa	0	0	0	0	1	0	1	1	1	4	-22.7235275	-65.69442211755737	Abra Pampa, Municipio de Abra Pampa, Departamento Cochinoca, Jujuy, 4640, Argentina
ARGENTINA	JUJUY	Cochinoca	Abralaite	0	0	0	0	0	0	1	0	0	1	-23.1698196	-65.7925547	Municipio de Abralaite, Departamento Cochinoca, Jujuy, Argentina
ARGENTINA	JUJUY	Cochinoca	Agua de Castilla	0	0	0	0	0	0	0	0	0	0	-23.2167913	-65.8078809	Agua de Castilla, Municipio de Abralaite, Departamento Cochinoca, Jujuy, Argentina
ARGENTINA	JUJUY	Cochinoca	Casabindo	0	0	0	0	0	0	0	0	0	0	-22.9846344	-66.0334001	Casabindo, Municipio de Abra Pampa, Departamento Cochinoca, Jujuy, Argentina
ARGENTINA	JUJUY	Cochinoca	Cochinoca	0	0	0	0	0	0	0	0	0	0	-22.7448936	-65.8959693	Cochinoca, Municipio de Abra Pampa, Departamento Cochinoca, Jujuy, Argentina
ARGENTINA	JUJUY	Cochinoca	La Redonda	0	0	0	0	0	0	0	0	1	1	-22.5294294	-65.5226812	La Redonda, Municipio de Puesto del Marqués, Departamento Cochinoca, Jujuy, Argentina
ARGENTINA	JUJUY	Cochinoca	Puesto del Marquéz	0	0	0	1	1	0	0	0	0	2			
ARGENTINA	JUJUY	Cochinoca	Quebraleña	0	0	0	0	0	0	0	0	0	0	-23.2886964	-65.7713691	Quebraleña, Municipio de Abralaite, Departamento Cochinoca, Jujuy, Argentina
ARGENTINA	JUJUY	Cochinoca	Quera	0	0	0	0	0	0	0	0	0	0	-23.1009795	-65.7635756	Quera, Municipio de Abralaite, Departamento Cochinoca, Jujuy, Argentina
ARGENTINA	JUJUY	Cochinoca	Rinconadillas	0	0	0	0	0	0	0	0	0	0	-23.3850752	-65.9567215	Rinconadillas, Municipio de Abdón Castro Tolay, Departamento Cochinoca, Jujuy, Argentina
ARGENTINA	JUJUY	Cochinoca	San Francisco de Alfarcito	0	0	0	0	0	0	0	0	0	0	-23.3198943	-65.973485	San Francisco de Alfarcito, Municipio de Abdón Castro Tolay, Departamento Cochinoca, Jujuy, Argentina
ARGENTINA	JUJUY	Cochinoca	Santa Ana de la Puna	0	0	0	0	0	0	0	0	0	0	-23.1255499	-66.0533274	Santa Ana de La Puna, Municipio de Abdón Castro Tolay, Departamento Cochinoca, Jujuy, Argentina
ARGENTINA	JUJUY	Cochinoca	Santuario de Tres Pozos	0	0	0	0	0	0	0	0	0	0	-23.5325683	-65.9633193	Santuario de Tres Pozos, Municipio de Abdón Castro Tolay, Departamento Cochinoca, Jujuy, Argentina
ARGENTINA	JUJUY	Cochinoca	Tambillos	0	0	0	0	0	0	0	0	0	0	-22.8968768	-65.9628641	Tambillos, Municipio de Abra Pampa, Departamento Cochinoca, Jujuy, Argentina
ARGENTINA	JUJUY	Cochinoca	Tusaquillas	0	0	0	0	0	0	0	0	0	0	-23.1900615	-65.9894411	Tusaquillas, Municipio de Abdón Castro Tolay, Departamento Cochinoca, Jujuy, Argentina
ARGENTINA	JUJUY	Doctor Manuel Belgrano	Dr. Manuel Belgrano	0	0	0	1	0	0	0	1	1	3	-24.1222004	-65.4015432	Doctor Manuel Belgrano, San Pablo de Reyes, Municipio de Yala, Departamento Doctor Manuel Belgrano, Jujuy, Y4601XAC, Argentina
ARGENTINA	JUJUY	Doctor Manuel Belgrano	Guerrero	1	1	0	1	1	1	1	0	0	6	-24.1858151	-65.4468348	Guerrero, Municipio de San Salvador de Jujuy, Departamento Doctor Manuel Belgrano, Jujuy, 4601, Argentina
ARGENTINA	JUJUY	Doctor Manuel Belgrano	La Almona	0	1	0	1	0	0	0	0	0	2	-24.2582541	-65.3925007	La Almona, Municipio de San Salvador de Jujuy, Departamento Doctor Manuel Belgrano, Jujuy, Argentina
ARGENTINA	JUJUY	Doctor Manuel Belgrano	León	0	1	0	0	0	0	0	0	1	2	-24.0369202	-65.4308398	León, Municipio de Yala, Departamento Doctor Manuel Belgrano, Jujuy, Argentina
ARGENTINA	JUJUY	Doctor Manuel Belgrano	Lozano (Ap. Chañi)	0	0	0	0	1	1	1	1	0	4	-24.0713816	-65.4761992	Lozano (Ap Chañi), Municipio de Yala, Departamento Doctor Manuel Belgrano, Jujuy, Argentina
ARGENTINA	JUJUY	Doctor Manuel Belgrano	Ocloyas	0	0	0	0	0	0	0	0	0	0	-23.9447222	-65.23149	Ocloyas, Municipio de San Salvador de Jujuy, Departamento Doctor Manuel Belgrano, Jujuy, Argentina
ARGENTINA	JUJUY	Doctor Manuel Belgrano	San Pablo De Reyes	0	0	0	0	0	0	0	0	0	0	-24.1452596	-65.395262	San Pablo de Reyes, Municipio de Yala, Departamento Doctor Manuel Belgrano, Jujuy, Y4601XAC, Argentina
ARGENTINA	JUJUY	Doctor Manuel Belgrano	San Salvador de Jujuy (Est. Jujuy)	1	1	0	1	1	1	1	1	1	8			
ARGENTINA	JUJUY	Doctor Manuel Belgrano	Yala	0	0	0	0	1	1	1	1	1	5	-24.121316	-65.4017626	Municipio de Yala, Departamento Doctor Manuel Belgrano, Jujuy, Argentina
ARGENTINA	JUJUY	El Carmen	Aguas Calientes	0	0	0	0	0	0	0	1	0	1	-24.5842514	-64.923213	Municipio de Aguas Calientes, Departamento El Carmen, Jujuy, 4431, Argentina
ARGENTINA	JUJUY	El Carmen	Barrio El Milagro	0	0	0	0	0	0	0	0	0	0	-24.4649893	-65.1191765	Barrio El Milagro, La Ovejería, Municipio de El Carmen, Departamento El Carmen, Jujuy, 4608, Argentina
ARGENTINA	JUJUY	El Carmen	Barrio La Unión	0	0	0	0	0	0	1	0	0	1			
ARGENTINA	JUJUY	El Carmen	El Carmen	1	1	0	1	1	1	1	1	1	8	-24.3858913	-65.2514148	Avenida Antártida Argentina, ADEP, San Carlos, Municipio de El Carmen, Departamento El Carmen, Jujuy, Y4603, Argentina
ARGENTINA	JUJUY	El Carmen	Fleming	0	0	0	0	1	1	0	0	0	2			
ARGENTINA	JUJUY	El Carmen	Los Lapachos (Est. Maquinista Verón)	0	0	0	0	1	1	0	0	0	2			
ARGENTINA	JUJUY	El Carmen	Loteo San Vicente	0	0	0	0	1	0	0	0	0	1			
ARGENTINA	JUJUY	El Carmen	Manantiales	0	0	0	0	1	1	0	0	1	3	-24.5339026	-64.9772447	Los Manantiales, Municipio de Puesto Viejo, Departamento El Carmen, Jujuy, Argentina
ARGENTINA	JUJUY	El Carmen	Monterrico	0	1	0	0	1	1	1	1	1	6	-24.4426474	-65.1591381	Hospital Monterrico, Municipio de El Carmen, Departamento El Carmen, Jujuy, 4608, Argentina
ARGENTINA	JUJUY	El Carmen	Pampa Blanca	1	1	0	0	1	1	1	1	1	7	-24.53441875	-65.074224527374	Pampa Blanca, Municipio de Pampa Blanca, Departamento El Carmen, Jujuy, Argentina
ARGENTINA	JUJUY	El Carmen	Perico	0	1	0	1	1	1	1	1	1	7	-24.3643141	-65.1414924	Río Perico, Municipio de Perico, Departamento El Carmen, Jujuy, Argentina
ARGENTINA	JUJUY	El Carmen	Pila Pardo	0	0	0	0	0	0	0	0	0	0	-24.5600485	-64.9153215	Pila Pardo, Municipio de Aguas Calientes, Departamento El Carmen, Jujuy, 4431, Argentina
ARGENTINA	JUJUY	El Carmen	Puesto Viejo	0	1	0	0	1	1	1	0	1	5	-24.4824157	-64.9674872	Municipio de Puesto Viejo, Departamento El Carmen, Jujuy, Argentina
ARGENTINA	JUJUY	El Carmen	San Isidro	0	0	0	0	0	0	0	0	0	0	-24.5740895	-64.9336165	San Isidro, Municipio de Aguas Calientes, Departamento El Carmen, Jujuy, 4431, Argentina
ARGENTINA	JUJUY	El Carmen	San Juancito	0	0	0	0	1	0	0	0	0	1	-24.3679149	-65.0156951	San Juancito, Municipio de Perico, Departamento El Carmen, Jujuy, Argentina
ARGENTINA	JUJUY	Humahuaca	Aparzo	0	0	0	0	0	0	0	0	0	0	-23.0996375	-65.1864222	Aparzo, Municipio de Humahuaca, Municipio de Palca de Aparzo, Departamento Humahuaca, Jujuy, Argentina
ARGENTINA	JUJUY	Humahuaca	Cianzo	0	0	0	0	0	0	0	0	0	0	-23.1733166	-65.1582974	Cianzo, Municipio de Humahuaca, Municipio de Palca de Aparzo, Departamento Humahuaca, Jujuy, Argentina
ARGENTINA	JUJUY	Humahuaca	Coctaca	0	0	0	0	0	0	0	0	0	0	-23.1481013	-65.2856111	Coctaca, Municipio de Humahuaca, Departamento Humahuaca, Jujuy, Argentina
ARGENTINA	JUJUY	Humahuaca	El Aguilar	0	0	0	0	1	1	1	0	1	4	-23.2156342	-65.6789304	Municipio de El Aguilar, Departamento Humahuaca, Jujuy, Argentina
ARGENTINA	JUJUY	Humahuaca	Hipólito Yrigoyen (Est. Iturbe)	0	0	0	1	0	0	0	0	0	1			
ARGENTINA	JUJUY	Humahuaca	Humahuaca	1	0	0	0	1	1	1	1	1	6	-23.20669515	-65.3495664002638	Humahuaca, Municipio de Humahuaca, Departamento Humahuaca, Jujuy, Y4630, Argentina
ARGENTINA	JUJUY	Humahuaca	Palca de Aparzo	0	0	0	0	1	0	0	0	0	1	-23.1231779	-65.1336425	Palca de Aparzo, Municipio de Palca de Aparzo, Departamento Humahuaca, Jujuy, Argentina
ARGENTINA	JUJUY	Humahuaca	Palca de Varas	0	0	0	0	0	0	0	0	0	0	-23.1006067	-65.1114433	Varas, 21 DE ENERO, Palca de Aparzo, Municipio de Palca de Aparzo, Departamento Humahuaca, Jujuy, Argentina
ARGENTINA	JUJUY	Humahuaca	Rodero	0	0	0	0	0	0	0	0	0	0	-23.0628654	-65.3277896	Rodero, Municipio de Humahuaca, Departamento Humahuaca, Jujuy, Argentina
ARGENTINA	JUJUY	Humahuaca	Tres Cruces	0	0	0	1	1	0	1	0	0	3	-22.9187513	-65.5878303	Comisión Municipal de Tres Cruces, Departamento Humahuaca, Jujuy, 4634, Argentina
ARGENTINA	JUJUY	Humahuaca	Uquía (Est. Senador Pérez)	1	0	0	1	0	0	1	0	0	3			
ARGENTINA	JUJUY	Ledesma	Bananal	0	0	0	0	0	0	0	0	0	0	-23.5661769	-64.5008697	Bananal, Municipio de Yuto, Departamento Ledesma, Jujuy, Argentina
ARGENTINA	JUJUY	Ledesma	Bermejito	0	0	0	0	0	0	0	0	0	0	-23.7885919	-64.729667	Bermejito, Municipio de Calilegua, Departamento Ledesma, Jujuy, Argentina
ARGENTINA	JUJUY	Ledesma	Caimancito	1	0	0	0	1	1	1	1	1	6	-23.73997935	-64.59372684590937	Caimancito, Departamento Ledesma, Jujuy, Argentina
ARGENTINA	JUJUY	Ledesma	Calilegua	0	1	0	0	1	1	0	1	1	5	-23.7726709	-64.7698109	Municipio de Calilegua, Departamento Ledesma, Jujuy, Argentina
ARGENTINA	JUJUY	Ledesma	Chalicán	0	0	0	0	1	0	0	1	0	2	-24.0704601	-64.807087	Chalicán, Municipio de Fraile Pintado, Departamento Ledesma, Jujuy, Argentina
ARGENTINA	JUJUY	Ledesma	Fraile Pintado	1	1	0	0	1	1	1	1	1	7	-23.94166105	-64.80223219279515	Fraile Pintado, Municipio de Fraile Pintado, Departamento Ledesma, Jujuy, 4506, Argentina
ARGENTINA	JUJUY	Ledesma	Libertad	0	0	0	0	0	0	0	0	0	0	-23.7624473	-64.7269655	Libertad, Municipio de Calilegua, Departamento Ledesma, Jujuy, Argentina
ARGENTINA	JUJUY	Ledesma	Libertador General San Martín (Est. Ledesma)	1	1	0	1	1	1	1	1	1	8			
ARGENTINA	JUJUY	Ledesma	Maíz Negro	0	0	0	0	0	0	0	0	0	0	-23.9512437	-64.7736472	Maiz Negro, Municipio de Fraile Pintado, Departamento Ledesma, Jujuy, 4506, Argentina
ARGENTINA	JUJUY	Ledesma	Paulina	0	0	0	0	0	0	0	0	0	0	-23.8328181	-64.7925439	Paulina, Ledesma, Libertador General San Martín, Municipio de Libertador General San Martín, Departamento Ledesma, Jujuy, 4512, Argentina
