Pais	Provincia	Partido	Localidad	ADSL	Cablemódem	Dial Up	Fibra óptica	4G	3G	Telefonía Fija	Wireless	Satelital	Total	Latitude	Longitude	location
ARGENTINA	CHACO	1º de Mayo	Margarita Belén	1	0	0	0	1	1	1	1	0	5	-27.2609791	-58.97368185607289	Margarita Belén, Municipio de Margarita Belén, Departamento Primero de Mayo, Chaco, 3505, Argentina
ARGENTINA	CHACO	2 de Abril	Hermoso Campo	0	1	0	1	1	1	1	0	1	6	-27.607395850000003	-61.32552690667098	Hermoso Campo, Municipio de Hermoso Campo, Departamento Dos de Abril, Chaco, Argentina
ARGENTINA	CHACO	2 de Abril	Itín	0	0	0	1	0	0	0	0	0	1	-27.4867136	-61.3235884	Itín, Municipio de Hermoso Campo, Departamento Dos de Abril, Chaco, Argentina
ARGENTINA	CHACO	25 de Mayo	Colonia Aborigen	0	0	0	0	1	0	0	1	0	2	-26.9567733	-60.2026412	Colonia Aborigen Chaco, Municipio de Colonia Aborigen, Departamento Veinticinco de Mayo, Chaco, Argentina
ARGENTINA	CHACO	25 de Mayo	Machagai	1	1	0	1	1	1	1	1	0	7	-26.92930105	-60.05823272462102	Machagai, Municipio de Machagai, Departamento Veinticinco de Mayo, Chaco, Argentina
ARGENTINA	CHACO	25 de Mayo	Napalpí	0	0	0	0	1	0	0	0	0	1	-26.90270735	-60.12882563141522	Napalpí, Municipio de Machagai, Departamento Veinticinco de Mayo, Chaco, Argentina
ARGENTINA	CHACO	9 de Julio	Las Breñas	1	0	0	1	1	1	1	0	1	6	-27.0863246	-61.0859456	Las Breñas, Departamento Nueve de Julio, Chaco, Argentina
ARGENTINA	CHACO	Almirante Brown	Concepción del Bermejo	0	0	0	1	1	1	1	1	1	6	-26.6003306	-60.9463769	Concepción del Bermejo, Municipio de Concepción del Bermejo, Almirante Brown, Chaco, Argentina
ARGENTINA	CHACO	Almirante Brown	Los Frentones	0	0	0	1	1	0	1	0	1	4	-26.4088995	-61.4131341	Los Frentones, Almirante Brown, Chaco, Argentina
ARGENTINA	CHACO	Almirante Brown	Pampa del Infierno	0	0	0	1	1	1	1	1	1	6	-26.5034702	-61.1764799	Municipio de Pampa del Infierno, Almirante Brown, Chaco, Argentina
ARGENTINA	CHACO	Almirante Brown	Río Muerto	0	0	0	0	1	0	0	0	0	1	-26.3081116	-61.6545439	Río Muerto, Los Frentones, Almirante Brown, Chaco, Argentina
ARGENTINA	CHACO	Almirante Brown	Taco Pozo	0	0	0	1	1	0	1	0	1	4	-25.61699095	-63.315498383718364	Taco Pozo, Almirante Brown, Chaco, Argentina
ARGENTINA	CHACO	Bermejo	General Vedia	1	0	0	1	1	0	1	1	1	6	-26.937354	-58.6611935	General Vedia, Municipio de General Vedia, Departamento Bermejo, Chaco, Argentina
ARGENTINA	CHACO	Bermejo	Isla del Cerrito	0	0	0	0	1	0	1	0	1	3	-27.2951994	-58.62300289157733	Isla del Cerrito, Municipio de Isla del Cerrito, Departamento Bermejo, Chaco, Argentina
ARGENTINA	CHACO	Bermejo	La Leonesa	1	0	0	0	1	1	1	1	0	5	-27.0376085	-58.70892150417669	La Leonesa, Municipio de La Leonesa, Departamento Bermejo, Chaco, H3518ZAA, Argentina
ARGENTINA	CHACO	Bermejo	Las Palmas	0	0	0	1	1	1	0	1	1	5	-27.0817093	-58.6696831338701	Las Palmas, Municipio de Las Palmas, Departamento Bermejo, Chaco, H3523ZAA, Argentina
ARGENTINA	CHACO	Bermejo	Puerto Bermejo Nuevo	0	0	0	1	0	0	1	1	0	3			
ARGENTINA	CHACO	Bermejo	Puerto Bermejo Viejo	0	0	0	0	1	0	0	0	0	1	-26.92909	-58.5089509	Puerto Bermejo Viejo, Municipio de Puerto Bermejo, Departamento Bermejo, Chaco, 3524, Argentina
ARGENTINA	CHACO	Bermejo	Puerto Eva Perón	0	0	0	1	1	0	0	1	1	4	-26.6634275	-58.6333575	Municipio de Puerto Eva Perón, Departamento Bermejo, Chaco, H3526, Argentina
ARGENTINA	CHACO	Chacabuco	Charata	1	0	0	1	1	1	1	1	1	7	-27.2178115	-61.1873712	Municipio de Charata, Departamento Chacabuco, Chaco, Argentina
ARGENTINA	CHACO	Comandante Fernández	Presidencia Roque Sáenz Peña	1	0	0	1	1	1	1	1	1	7	-26.7909093	-60.4410391	Municipio de Presidencia Roque Sáenz peña, Departamento Comandante Fernández, Chaco, Argentina
ARGENTINA	CHACO	Fray Justo Santa María de Oro	Chorotis	0	0	0	0	1	0	0	0	0	1	-27.9184246	-61.399528412119636	Chorotis, Municipio de Chorotis, Departamento Fray Justo Santa María de Oro, Chaco, Argentina
ARGENTINA	CHACO	Fray Justo Santa María de Oro	Santa Sylvina	0	1	0	0	1	1	0	0	1	4	-27.83264285	-61.13717738560928	Santa Sylvina, Municipio de Santa Sylvina, Departamento Fray Justo Santa María de Oro, Chaco, Argentina
ARGENTINA	CHACO	Fray Justo Santa María de Oro	Venados Grandes	0	0	0	0	0	0	0	0	0	0	-27.8153318	-61.3859168	Venados Grandes, Municipio de Chorotis, Departamento Fray Justo Santa María de Oro, Chaco, Argentina
ARGENTINA	CHACO	General Belgrano	Corzuela	1	0	0	1	1	1	1	1	1	7	-26.955204600000002	-60.96987074432184	Corzuela, Municipio de Corzuela, Departamento General Belgrano, Chaco, Argentina
ARGENTINA	CHACO	General Donovan	La Escondida	1	1	0	1	1	1	1	0	1	7	-27.1053452	-59.446305	La Escondida, Municipio de La Escondida, Departamento General Dónovan, Chaco, Argentina
ARGENTINA	CHACO	General Donovan	La Verde	1	0	0	1	1	1	1	0	1	6	-27.1304632	-59.3762738	La Verde, Municipio de La Verde, Departamento General Dónovan, Chaco, Argentina
ARGENTINA	CHACO	General Donovan	Lapachito	1	0	0	1	1	1	1	0	0	5	-27.1593809	-59.3854377	Lapachito, Municipio de Lapachito, Departamento General Dónovan, Chaco, Argentina
ARGENTINA	CHACO	General Donovan	Makallé	1	1	0	0	1	1	1	0	1	6	-27.2058189	-59.2871558	Makallé, Municipio de Makallé, Departamento General Dónovan, Chaco, Argentina
ARGENTINA	CHACO	General Güemes	El Espinillo	0	0	0	0	1	0	0	0	1	2	-25.4078162	-60.4480202	El Espinillo, Municipio de El Espinillo, Departamento General Güemes, Chaco, Argentina
ARGENTINA	CHACO	General Güemes	El Sauzal	0	0	0	0	0	0	0	1	1	2	-24.5772514	-61.5316855	El Sauzal, Municipio de El Sauzalito, Departamento General Güemes, Chaco, Argentina
ARGENTINA	CHACO	General Güemes	El Sauzalito	0	0	0	0	1	0	1	0	1	3	-24.430807950000002	-61.70204474968414	El Sauzalito, Municipio de El Sauzalito, Departamento General Güemes, Chaco, Argentina
ARGENTINA	CHACO	General Güemes	Fortín Lavalle	0	0	0	0	0	0	0	1	0	1	-25.7030792	-60.2007197	Fortín Lavalle, Municipio de Villa Río Bermejito, Departamento General Güemes, Chaco, Argentina
ARGENTINA	CHACO	General Güemes	Fuerte Esperanza	0	0	0	1	1	0	1	0	1	4	-25.1668029	-61.83712663345649	Fuerte Esperanza, Municipio de Fuerte Esperanza, Departamento General Güemes, Chaco, Argentina
ARGENTINA	CHACO	General Güemes	Juan José Castelli	1	0	0	1	1	1	1	1	0	6	-25.9467092	-60.6200235	Municipio de Juan José Castelli, Departamento General Güemes, Chaco, 3703, Argentina
ARGENTINA	CHACO	General Güemes	Miraflores	0	0	0	0	1	0	0	1	0	2	-25.6516565	-60.92482812224917	Miraflores, Municipio de Miraflores, Departamento General Güemes, Chaco, Argentina
ARGENTINA	CHACO	General Güemes	Nueva Pompeya	0	0	0	1	0	0	0	1	1	3	-24.9330267	-61.4831902	Misión Nueva Pompeya, Municipio de Misión Nueva Pompeya, Departamento General Güemes, Chaco, Argentina
ARGENTINA	CHACO	General Güemes	Puerto Lavalle	0	0	0	0	0	0	0	0	0	0	-25.6548383	-60.1364583	Puerto Lavalle, Municipio de Villa Río Bermejito, Departamento General Güemes, Chaco, Argentina
ARGENTINA	CHACO	General Güemes	Villa Río Bermejito	1	0	0	1	1	0	1	1	1	6	-25.6373455	-60.2657176	Municipio de Villa Río Bermejito, Departamento General Güemes, Chaco, H3703, Argentina
ARGENTINA	CHACO	General Güemes	Wichi	0	0	0	0	0	0	0	1	1	2	-24.69023	-61.426214	Wichí - El Pintado, Municipio de El Sauzalito, Departamento General Güemes, Chaco, Argentina
ARGENTINA	CHACO	General Güemes	Zaparinqui	0	0	0	0	0	0	0	0	0	0	-26.0653724	-60.5614209	Zaparinqui, Municipio de Juan José Castelli, Departamento General Güemes, Chaco, Argentina
ARGENTINA	CHACO	Independencia	Avia Terai	1	0	0	1	1	1	1	1	1	7	-26.686057599999998	-60.72835666201627	Avia Terai, Municipio de Avia Terai, Departamento Independencia, Chaco, Argentina
ARGENTINA	CHACO	Independencia	Campo Largo	1	0	0	1	1	1	1	0	0	5	-26.8003613	-60.8390804	Campo Largo, Departamento Independencia, Chaco, Argentina
ARGENTINA	CHACO	Independencia	Fortín Las Chuñas	0	0	0	0	1	0	0	0	0	1	-26.8851806	-60.9088961	Fortín Las Chuñas, Campo Largo, Departamento Independencia, Chaco, Argentina
ARGENTINA	CHACO	Independencia	Napenay	0	0	0	0	1	0	1	0	0	2	-26.72464495	-60.623615421368115	Napenay, Municipio de Napenay, Departamento Independencia, Chaco, Argentina
ARGENTINA	CHACO	Libertad	Colonia Popular	0	0	0	0	1	0	1	1	0	3	-27.2754972	-59.148844835749074	Colonia Popular, Departamento Libertad, Chaco, Argentina
ARGENTINA	CHACO	Libertad	Estación General Obligado	0	0	0	0	0	0	0	0	0	0			
ARGENTINA	CHACO	Libertad	Laguna Blanca	0	0	0	0	0	0	1	1	1	3	-27.2546282	-59.23344696926695	Laguna Blanca, Departamento Libertad, Chaco, Argentina
ARGENTINA	CHACO	Libertad	Puerto Tirol	1	1	0	1	1	1	1	1	0	7	-27.376511100000002	-59.08500094165363	Puerto Tirol, Departamento Libertad, Chaco, Argentina
ARGENTINA	CHACO	Libertador General San Martín	Ciervo Petiso	0	0	0	0	1	0	0	0	1	2	-26.59868085	-59.62908586413711	Ciervo Petiso, Municipio de Ciervo Petiso, Departamento Libertador General San Martín, Chaco, Argentina
ARGENTINA	CHACO	Libertador General San Martín	General José de San Martín	1	1	0	1	1	1	1	1	0	7	-26.536411	-59.3414935	Municipio de General José de San Martín, Departamento Libertador General San Martín, Chaco, 3509, Argentina
ARGENTINA	CHACO	Libertador General San Martín	La Eduvigis	0	0	0	0	1	0	0	0	1	2	-26.8389004	-59.060372003106835	La Eduvigis, Municipio de La Eduvigis, Departamento Libertador General San Martín, Chaco, Argentina
ARGENTINA	CHACO	Libertador General San Martín	Laguna Limpia	0	0	0	0	1	0	0	1	0	2	-26.493412499999998	-59.68112969896069	Laguna Limpia, Municipio de Laguna Limpia, Departamento Libertador General San Martín, Chaco, Argentina
ARGENTINA	CHACO	Libertador General San Martín	Pampa Almirón	0	0	0	1	1	1	0	1	0	4	-26.7033269	-59.1161001799584	Pampa Almirón, Municipio de Pampa Almirón, Departamento Libertador General San Martín, Chaco, Argentina
ARGENTINA	CHACO	Libertador General San Martín	Pampa del Indio	0	0	0	1	1	1	1	1	1	6	-26.048588	-59.92678409099645	Pampa del Indio, Municipio de Pampa del Indio, Departamento Libertador General San Martín, Chaco, Argentina
ARGENTINA	CHACO	Libertador General San Martín	Presidencia Roca	0	0	0	1	1	1	1	1	1	6	-26.1353908	-59.592399394708046	Presidencia Roca, Municipio de Presidencia Roca, Departamento Libertador General San Martín, Chaco, Argentina
ARGENTINA	CHACO	Libertador General San Martín	Selvas del Río de Oro	0	0	0	0	1	0	0	0	0	1	-26.8029435	-58.956749	Selvas del Río de Oro, Municipio de La Eduvigis, Departamento Libertador General San Martín, Chaco, Argentina
ARGENTINA	CHACO	Maipú	Tres Isletas	1	0	0	0	1	1	1	1	0	5	-26.3419469	-60.427926594151	Tres Isletas, Municipio de Tres Isletas, Departamento Maipú, Chaco, H3703ZAA, Argentina
ARGENTINA	CHACO	Mayor Luis J. Fontana	Coronel Du Graty	1	1	0	1	1	1	0	1	1	7	-27.6821132	-60.9045554	Municipio de Coronel Du Graty, Departamento Mayor Luis Jorge Fontana, Chaco, 3541, Argentina
ARGENTINA	CHACO	Mayor Luis J. Fontana	Enrique Urién	0	0	0	1	0	0	0	0	0	1	-27.5555335	-60.530100704856565	Enrique Urién, Municipio de Enrique Urién, Departamento Mayor Luis Jorge Fontana, Chaco, Argentina
ARGENTINA	CHACO	Mayor Luis J. Fontana	Villa Angela	1	0	0	1	1	1	1	1	0	6			
ARGENTINA	CHACO	O Higgins	La Clotilde	0	0	0	0	1	0	0	0	0	1	-27.1779802	-60.63106101932658	La Clotilde, Municipio de La Clotilde, Departamento O'Higgins, Chaco, H3725ZAA, Argentina
ARGENTINA	CHACO	O Higgins	La Tigra	0	0	0	0	1	0	0	0	0	1	-27.121908400000002	-60.59065488494146	La Tigra, Municipio de La Tigra, Departamento O'Higgins, Chaco, H3701ZAA, Argentina
ARGENTINA	CHACO	O Higgins	San Bernardo	0	0	0	0	1	1	0	0	0	2	-27.2867286	-60.7128954	Municipio de San Bernardo, Departamento O'Higgins, Chaco, Argentina
ARGENTINA	CHACO	Presidencia de la Plaza	Presidencia de la Plaza	1	1	0	1	1	1	1	1	0	7	-27.00416935	-59.8430992986941	Presidencia de la Plaza, Municipio de Presidencia de la Plaza, Departamento Presidencia de la Plaza, Chaco, H3536, Argentina
ARGENTINA	CHACO	Quitilipi	Quitilipi	1	0	0	1	1	1	1	1	0	6	-26.8732221	-60.21298971406674	Quitilipi, Municipio de Quitilipi, Departamento Quitilipi, Chaco, Argentina
ARGENTINA	CHACO	Quitilipi	Villa El Palmar	0	0	0	0	1	0	0	1	0	2	-26.4545108	-60.1643891	Villa Rural El Palmar, Departamento Quitilipi, Chaco, Argentina
ARGENTINA	CHACO	San Fernando	Barranqueras	1	1	0	1	1	1	1	1	0	7	-27.4850978	-58.9308766	Barranqueras, Departamento San Fernando, Chaco, H3503, Argentina
ARGENTINA	CHACO	San Fernando	Basail	1	1	0	0	1	1	1	1	1	7	-27.88850625	-59.28487581701083	Basail, Municipio de Basail, Departamento San Fernando, Chaco, Argentina
ARGENTINA	CHACO	San Fernando	Colonia Baranda	0	0	0	0	1	1	0	0	0	2	-27.5600977	-59.3073397	Colonia Baranda, Departamento San Fernando, Chaco, Argentina
ARGENTINA	CHACO	San Fernando	Fontana	0	0	0	1	1	1	0	1	0	4	-27.4172158	-59.0342223	Fontana, Municipio de Fontana, Departamento San Fernando, Chaco, Argentina
ARGENTINA	CHACO	San Fernando	Puerto Vilelas	0	0	0	1	1	1	0	0	1	4	-27.5171208	-58.9405157	Puerto Vilelas, Municipio de Puerto Vilelas, Departamento San Fernando, Chaco, Argentina
ARGENTINA	CHACO	San Fernando	Resistencia	1	1	1	1	1	1	1	1	1	9	-27.4511235	-58.9865196	Resistencia, Municipio de Resistencia, Departamento San Fernando, Chaco, Argentina
ARGENTINA	CHACO	San Lorenzo	Samuhú	0	0	0	0	1	0	0	0	1	2	-27.5187374	-60.3934925	Samuhú, Municipio de Samuhú, Departamento San Lorenzo, Chaco, Argentina
ARGENTINA	CHACO	San Lorenzo	Villa Berthet	0	0	0	1	1	1	0	1	1	5	-27.292233799999998	-60.41027616687617	Villa Berthet, Municipio de Villa Berthet, Departamento San Lorenzo, Chaco, H3545ZAA, Argentina
ARGENTINA	CHACO	Sargento Cabral	Capitán Solari	0	0	0	1	1	1	1	1	0	5	-26.8024827	-59.557308	Capitán Solari, Municipio de Capitán Solari, Departamento Sargento Cabral, Chaco, Argentina
ARGENTINA	CHACO	Sargento Cabral	Colonia Elisa	0	0	0	0	1	1	1	0	1	4	-26.9316293	-59.5187724	Colonia Elisa, Municipio de Colonia Elisa, Departamento Sargento Cabral, Chaco, Argentina
ARGENTINA	CHACO	Sargento Cabral	Colonias Unidas	0	0	0	1	1	1	1	1	0	5	-26.69948385	-59.630874112624944	Colonias Unidas, Municipio de Colonias Unidas, Departamento Sargento Cabral, Chaco, H3532ZAA, Argentina
ARGENTINA	CHACO	Sargento Cabral	Ingeniero Barbet	0	0	0	0	0	0	0	0	0	0	-27.0018632	-59.4812818	Ingeniero Barbet, Municipio de Colonia Elisa, Departamento Sargento Cabral, Chaco, Argentina
ARGENTINA	CHACO	Sargento Cabral	Las Garcitas	0	0	0	0	1	1	1	1	1	5	-26.6278844	-59.78863877423133	Las Garcitas, Municipio de Las Garcitas, Departamento Sargento Cabral, Chaco, 3533, Argentina
ARGENTINA	CHACO	Tapenagá	Charadai	0	0	0	1	1	1	1	0	1	5	-27.6545516	-59.862857	Charadai, Municipio de Charadai, Departamento Tapenagá, Chaco, Argentina
ARGENTINA	CHACO	Tapenagá	Cote Lai	0	0	0	0	1	0	0	0	0	1	-27.5297408	-59.5732399	Municipio de Cote Lai, Departamento Tapenagá, Chaco, Argentina
ARGENTINA	CHACO	Tapenagá	Haumonía	0	0	0	0	0	0	0	0	0	0	-27.5071316	-60.1777382	Haumonia, Municipio de Charadai, Departamento Tapenagá, Chaco, Argentina
ARGENTINA	CHACO	Tapenagá	Horquilla	0	0	0	0	0	0	0	0	0	0	-27.5415289	-59.9563746	Horquilla, Municipio de Charadai, Departamento Tapenagá, Chaco, Argentina
ARGENTINA	CHACO	Tapenagá	La Sabana	0	0	0	0	0	0	0	0	0	0	-27.8723467	-59.9386455	La Sabana, Municipio de Charadai, Departamento Tapenagá, Chaco, 3513, Argentina
ARGENTINA	CHUBUT	Biedma	Arroyo Verde	0	0	0	0	0	0	1	0	1	2	-41.9964299	-65.2935893	Arroyo Verde, Departamento Biedma, Chubut, Argentina
ARGENTINA	CHUBUT	Biedma	Puerto Madryn	1	1	1	1	1	1	1	1	1	9	-42.7729674	-65.0366104	Municipio de Puerto Madryn, Departamento Biedma, Chubut, Argentina
ARGENTINA	CHUBUT	Biedma	Puerto Pirámide	0	0	0	0	1	1	1	1	1	5	-42.571901	-64.283409	Hospital Rural Puerto Piramides, Biedma, Puerto Pirámides, Comuna Rural de Puerto Pirámides, Departamento Biedma, Chubut, Argentina
ARGENTINA	CHUBUT	Biedma	Quinta El Mirador	0	0	0	0	1	1	0	1	0	3			
ARGENTINA	CHUBUT	Biedma	Reserva Area Protegida El Doradillo	0	0	0	0	0	0	0	1	0	1			
ARGENTINA	CHUBUT	Cushamen	Buenos Aires Chico	0	0	0	0	0	0	0	0	0	0	-42.0668114	-71.2150285	Buenos Aires Chico, Municipio de El Maitén, Departamento Cushamen, Chubut, Argentina
ARGENTINA	CHUBUT	Cushamen	Cholila	0	0	1	0	1	1	1	0	1	5	-42.5112728	-71.4312207	Cholila, Municipio de Cholila, Departamento Cushamen, Chubut, 9127, Argentina
ARGENTINA	CHUBUT	Cushamen	Costa del Chubut	0	0	0	0	0	0	0	0	0	0	-42.6045223	-70.4572714	Costa del Chubut, Departamento Cushamen, Chubut, Argentina
ARGENTINA	CHUBUT	Cushamen	Cushamen Centro	0	0	0	0	0	0	1	0	0	1	-42.172596	-70.6629724	Hospital Rural Cushamen, Cushamen, Comuna Rural de Cushamen, Departamento Cushamen, Chubut, 9217, Argentina
ARGENTINA	CHUBUT	Cushamen	El Hoyo	1	0	0	1	0	0	1	1	0	4	-42.0659199	-71.5210592	El Hoyo, Municipio de El Hoyo, Departamento Cushamen, Chubut, Argentina
ARGENTINA	CHUBUT	Cushamen	El Maitén	0	0	0	0	0	0	1	1	0	2	-42.050957	-71.1682981	El Maitén, Municipio de El Maitén, Departamento Cushamen, Chubut, Argentina
ARGENTINA	CHUBUT	Cushamen	Epuyén	1	0	0	0	1	0	1	0	0	3	-42.2314766	-71.3690651	Epuyen, Municipio de Epuyén, Departamento Cushamen, Chubut, Argentina
ARGENTINA	CHUBUT	Cushamen	Fofo Cahuel	0	0	0	0	0	0	0	0	0	0	-42.4078367	-70.5295229	Fofo Cahuel, Departamento Cushamen, Chubut, Argentina
ARGENTINA	CHUBUT	Cushamen	Gualjaina	0	0	0	0	0	0	1	0	1	2	-42.7242052	-70.5386908	Gualjaina, Comisión de Fomento de Gualjaina, Departamento Cushamen, Chubut, Argentina
ARGENTINA	CHUBUT	Cushamen	Lago Epuyén	0	0	0	0	0	0	0	0	0	0	-42.185500000000005	-71.517325	Lago Epuyén, Municipio de Epuyén, Departamento Cushamen, Chubut, Argentina
ARGENTINA	CHUBUT	Cushamen	Lago Puelo	1	0	0	1	1	1	1	1	0	6	-42.160624999999996	-71.64016645696006	Lago Puelo, Departamento Cushamen, Chubut, Argentina
ARGENTINA	CHUBUT	Cushamen	Leleque	0	0	0	0	0	0	1	0	1	2	-42.4114302	-71.0701814	Leleque, Departamento Cushamen, Chubut, Argentina
ARGENTINA	CHUBUT	Escalante	Acceso Norte	0	0	0	0	1	1	0	0	1	3	-45.7882975	-67.50895524509815	Acceso Norte, Municipio de Comodoro Rivadavia, Departamento Escalante, Chubut, Argentina
ARGENTINA	CHUBUT	Escalante	Astra	0	0	0	0	0	1	0	0	0	1	-45.7330312	-67.4938717	Astra, Municipio de Comodoro Rivadavia, Departamento Escalante, Chubut, 9003, Argentina
ARGENTINA	CHUBUT	Escalante	Bahía Bustamante	0	0	0	0	0	0	0	0	0	0	-45.1270778	-66.5368939	Bahía Bustamante, Departamento Escalante, Chubut, Argentina
ARGENTINA	CHUBUT	Escalante	Barrio 25 De Mayo	0	0	0	0	1	1	0	0	0	2			
ARGENTINA	CHUBUT	Escalante	Barrio Caleta Cordova	0	0	0	0	0	1	0	0	1	2	-45.7484799	-67.3777357	Caleta Córdova, Municipio de Comodoro Rivadavia, Departamento Escalante, Chubut, Argentina
ARGENTINA	CHUBUT	Escalante	Barrio Caleta Olivares	0	0	0	0	0	0	0	0	0	0	-45.7484799	-67.3777357	Caleta Córdova, Municipio de Comodoro Rivadavia, Departamento Escalante, Chubut, Argentina
ARGENTINA	CHUBUT	Escalante	Barrio Castelli	0	0	0	0	1	1	0	0	0	2	-45.8163661	-67.4727418	Juan José Castelli, Municipio de Comodoro Rivadavia, Departamento Escalante, Chubut, Argentina
ARGENTINA	CHUBUT	Escalante	Barrio Ciudadela	0	0	0	0	0	0	0	0	0	0	-45.7965409	-67.4969645	Ciudadela, Municipio de Comodoro Rivadavia, Departamento Escalante, Chubut, 9005, Argentina
ARGENTINA	CHUBUT	Escalante	Barrio Gasoducto	0	0	0	0	1	1	0	0	0	2	-45.8764003	-68.3959532	Cañadón Lagarto, Departamento Sarmiento, Chubut, Argentina
ARGENTINA	CHUBUT	Escalante	Barrio Guemes	0	0	0	0	0	0	0	0	0	0	-45.8217183	-67.4910109	Güemes, Municipio de Comodoro Rivadavia, Departamento Escalante, Chubut, 9005, Argentina
ARGENTINA	CHUBUT	Escalante	Barrio Laprida	0	0	0	0	0	0	0	0	0	0	-45.8279966	-67.5451047	Cuartel de Bomberos de Barrio Laprida, Jamaica, Laprida, Municipio de Comodoro Rivadavia, Departamento Escalante, Chubut, 9000, Argentina
ARGENTINA	CHUBUT	Escalante	Barrio Manantial Rosales	0	0	0	0	0	0	0	0	0	0	-45.8227931	-67.5261092	Manantial Rosales, Municipio de Comodoro Rivadavia, Departamento Escalante, Chubut, Argentina
ARGENTINA	CHUBUT	Escalante	Barrio Militar - Aeropuerto Militar	0	0	0	0	1	1	0	0	0	2			
ARGENTINA	CHUBUT	Escalante	Barrio Prospero Palazzo	0	0	0	0	1	1	0	0	0	2	-45.808163	-67.4606664	Las Orquideas, Municipio de Comodoro Rivadavia, Departamento Escalante, Chubut, 9005, Argentina
ARGENTINA	CHUBUT	Escalante	Barrio Restinga Ali	0	0	0	0	1	1	0	0	0	2	-45.7956026	-67.4231046	Don Bosco, Km. 8 - Don Bosco, Municipio de Comodoro Rivadavia, Departamento Escalante, Chubut, Argentina
ARGENTINA	CHUBUT	Escalante	Barrio Rodriguez Peña	0	0	0	0	0	0	0	0	0	0	-45.811474	-67.4740271	Nicolás Rodriguez Peña, Municipio de Comodoro Rivadavia, Departamento Escalante, Chubut, Argentina
ARGENTINA	CHUBUT	Escalante	Barrio Saavedra	0	0	0	0	1	1	0	0	0	2	-45.8418889	-67.5074959	Saavedra, Municipio de Comodoro Rivadavia, Departamento Escalante, Chubut, Argentina
ARGENTINA	CHUBUT	Escalante	Barrio Sarmiento	0	0	0	0	0	1	0	0	0	1	-45.8192077	-67.5033824	Sarmiento, Municipio de Comodoro Rivadavia, Departamento Escalante, Chubut, Argentina
ARGENTINA	CHUBUT	Escalante	Barrio Villa S.U.P.E.	0	0	0	0	1	1	0	0	0	2	-43.3081474	-65.7035806	Escalante, Chacra 323A, Dolavon, Municipio de Dolavon, Departamento Gaiman, Chubut, Argentina
ARGENTINA	CHUBUT	Escalante	Comodoro Rivadavia	1	1	1	1	1	1	1	1	1	9	-45.8632024	-67.4752615	Municipio de Comodoro Rivadavia, Departamento Escalante, Chubut, Argentina
ARGENTINA	CHUBUT	Escalante	Diadema Argentina	0	0	0	0	1	1	0	1	0	3	-45.7798477	-67.6719407	Diadema Argentina, Municipio de Comodoro Rivadavia, Departamento Escalante, Chubut, 9009, Argentina
ARGENTINA	CHUBUT	Escalante	Km. 11 - Cuarteles	0	0	0	0	0	0	0	0	1	1	-45.773925250000005	-67.4352786315055	Km. 11 - Cuarteles, Municipio de Comodoro Rivadavia, Departamento Escalante, Chubut, Argentina
ARGENTINA	CHUBUT	Escalante	KM. 3 - General Mosconi	0	0	0	0	1	1	0	0	0	2	-45.8378959	-67.4788765	Km. 3 - General Mosconi, Municipio de Comodoro Rivadavia, Departamento Escalante, Chubut, Argentina
ARGENTINA	CHUBUT	Escalante	KM. 5 - Presidente Ortiz	0	0	0	0	0	0	0	0	0	0	-45.8142499	-67.4581549	Presidente Ortiz, Km. 5 - Presidente Roberto Ortiz, Municipio de Comodoro Rivadavia, Departamento Escalante, Chubut, 9005, Argentina
ARGENTINA	CHUBUT	Escalante	KM. 8 - Don Bosco	0	0	0	0	1	1	0	0	0	2	-45.7972325	-67.43075495930987	Km. 8 - Don Bosco, Municipio de Comodoro Rivadavia, Departamento Escalante, Chubut, Argentina
ARGENTINA	CHUBUT	Escalante	Rada Tilly	1	0	1	1	1	1	1	1	0	7	-45.925919	-67.5533438	Municipio de Rada Tilly, Departamento Escalante, Chubut, Argentina
ARGENTINA	CHUBUT	Florentino Ameghino	Camarones	0	0	0	0	1	0	1	1	1	4	-44.7982221	-65.7101934	Camarones, Municipio de Camarones, Departamento Florentino Ameghino, Chubut, Argentina
ARGENTINA	CHUBUT	Florentino Ameghino	Garayalde	0	0	0	0	0	0	0	1	0	1	-44.6889967	-66.6227526	Garayalde, Departamento Florentino Ameghino, Chubut, 9007, Argentina
ARGENTINA	CHUBUT	Futaleufú	Aldea Escolar	0	0	0	0	0	0	1	0	0	1	-43.1351894	-71.5489529	Aldea Escolar, Municipio de Trevelin, Departamento Futaleufú, Chubut, Argentina
ARGENTINA	CHUBUT	Futaleufú	Corcovado	0	0	1	0	0	0	1	0	1	3	-43.5396568	-71.4681317	Corcovado, Municipio de Corcovado, Departamento Futaleufú, Chubut, Argentina
ARGENTINA	CHUBUT	Futaleufú	Esquel	1	1	1	0	1	1	1	1	1	8	-42.91337825	-71.31328322473286	Esquel, Municipio de Esquel, Departamento Futaleufú, Chubut, U9200, Argentina
ARGENTINA	CHUBUT	Futaleufú	Lago Rosario	0	0	0	0	0	0	1	0	1	2	-43.2464284	-71.3490226	Lago Rosario, Municipio de Trevelin, Departamento Futaleufú, Chubut, Argentina
ARGENTINA	CHUBUT	Futaleufú	Los Cipreses	0	0	0	0	0	0	1	0	1	2	-43.1830949	-71.641928	Los Cipreses, Municipio de Trevelin, Departamento Futaleufú, Chubut, Argentina
ARGENTINA	CHUBUT	Futaleufú	Trevelín	1	0	1	0	1	1	1	1	1	7	-43.0791069	-71.4640493	Trevelin, Municipio de Trevelin, Departamento Futaleufú, Chubut, Argentina
ARGENTINA	CHUBUT	Futaleufú	Villa Futalaufquen	0	0	0	0	0	0	1	0	1	2	-42.8938404	-71.6179479	Villa Futalafquen, Departamento Futaleufú, Chubut, Argentina
ARGENTINA	CHUBUT	Gaiman	28 de Julio	0	0	0	1	1	1	0	0	1	4	-43.28896	-65.4937885	28 de Julio, Centro, Gaiman, Municipio de Gaiman, Departamento Gaiman, Chubut, 9105, Argentina
ARGENTINA	CHUBUT	Gaiman	Dique Florentino Ameghino	0	0	0	0	0	0	1	0	0	1	-43.700026449999996	-66.48350550114426	Dique Florentino Ameghino, Comuna Rural de Dique Florentino Ameghino, Departamento Gaiman, Chubut, Argentina
ARGENTINA	CHUBUT	Gaiman	Dolavon	0	0	1	1	1	0	1	0	1	5	-43.3080688	-65.7105566	Dolavon, Municipio de Dolavon, Departamento Gaiman, Chubut, Argentina
ARGENTINA	CHUBUT	Gaiman	Gaiman	1	0	1	1	1	1	1	0	1	7	-43.286401749999996	-65.5094535592799	Gaiman Nuevo, Gaiman, Municipio de Gaiman, Departamento Gaiman, Chubut, Argentina
ARGENTINA	CHUBUT	Gastre	Blancuntre	0	0	0	0	0	0	1	0	1	2	-42.6203693	-68.9040372	Blancuntre, Departamento Gastre, Chubut, Argentina
ARGENTINA	CHUBUT	Gastre	El Escorial	0	0	0	0	0	0	1	0	1	2	-43.0904844	-68.5392742	El Escorial, Departamento Gastre, Chubut, Argentina
ARGENTINA	CHUBUT	Gastre	Gastre	0	0	0	0	1	0	1	1	0	3	-42.2631553	-69.2219873	Gastre, Comuna Rural de Gastre, Departamento Gastre, Chubut, Argentina
ARGENTINA	CHUBUT	Gastre	Lagunita Salada	0	0	0	0	0	0	1	1	1	3	-42.7435865	-69.1488547	Lagunita Salada, Comuna Rural de Lagunita Salada, Departamento Gastre, Chubut, Argentina
ARGENTINA	CHUBUT	Gastre	Yala Laubat	0	0	0	0	0	0	0	0	1	1	-42.7596201	-68.8652243	Yala Laubat, Departamento Gastre, Chubut, Argentina
ARGENTINA	CHUBUT	Languiñeo	Aldea Epulef	0	0	0	0	0	0	1	1	1	3	-43.3211034	-69.6927059	Comuna Rural de Aldea Epulef, Departamento Languiñeo, Chubut, Argentina
ARGENTINA	CHUBUT	Languiñeo	Carrenleufú	0	0	0	0	0	0	1	0	1	2	-43.58774	-71.7020456	Carrenleufú, Comuna Rural de Carrenleufú, Departamento Languiñeo, Chubut, Argentina
ARGENTINA	CHUBUT	Languiñeo	Colan Conhue	0	0	0	0	0	0	1	1	1	3	-43.2408732	-69.9306932	Comuna Rural de Colan Conhué, Departamento Languiñeo, Chubut, Argentina
ARGENTINA	CHUBUT	Languiñeo	Paso del Sapo	0	0	0	0	0	0	1	1	1	3	-42.7358093	-69.6101601	Paso del Sapo, Comuna Rural de Paso del Sapo, Departamento Languiñeo, Chubut, Argentina
ARGENTINA	CHUBUT	Languiñeo	Tecka	0	0	0	0	0	0	1	0	1	2	-43.4927699	-70.8109003	Tecka, Municipio de Tecka, Departamento Languiñeo, Chubut, U9201, Argentina
ARGENTINA	CHUBUT	Mártires	El Mirasol	0	0	0	0	0	0	0	0	1	1	-43.2837112	-67.7606784	El Mirasol, Departamento Mártires, Chubut, Argentina
